reviewTime,helpful,overall,summary,asin,reviewerName,reviewerID,reviewText,unixReviewTime
"07 12, 2014","[0, 0]",5.0,My children all work odd hours so these are a ...,B0001FTVEK,,APAEK95R7T8RD,My children all work odd hours so these are a lifesaver in letting anyone watch TV and not disturb the rest of the family,1405123200
"06 14, 2013","[0, 2]",2.0,loss of quality! not  worth it! cheap build qualit... is comfortable but not super light... sound loss and buzzing sound i tried,B0001FTVEK,0_0Donuts,AKIGZKDK3CK5F,all the frequency. rather i can get a 3.5mm adapter jack and use it to hear my tv through it ! a much cheaper and better alternative if you just want to hear your tv while parents sleep.GTMax 3.5mm Female to 2 RCA Male Cable + headphones is better! cheaper and better BUT THAT WONT BE WIRELESS~!,1371168000
"12 22, 2005","[13, 14]",5.0,Outstanding,B0001FTVEK,"&#34;Sam&#34; Twain ""Samuca""",AXKI4FBLRF42D,"Before ordering this headphone I read very carefully previous reviews. The reviews I read were helpful, well written and I was stimulated to write my own. There were basically two groups of reviews, one being highly complimentary of the RS-120 and the other group complained about noise, hiss, and comfort. My own review falls in the first group. However I must say that noise and hiss can happen in some environments and are not necessarily a problem with the headphone. In fact, it is easy for me to induce noise/hiss when I approach the motor of the refrigerator or I approach the emitter from other electronic equipment. Noise/hiss are nightmares for engineers and sometimes there is not much that we can do to eliminate these problems in the immediate physical world that surrounds us. We need to troubleshoot to get the best location of the emitter in order to enjoy this remarkable set of headphones. And the price at Amazon was a real bargain.",1135209600
"01 11, 2012","[0, 0]",4.0,Good product,B0001FTVEK,454Malibu,A4TE49CI8PH2S,"Really like these headphones. They sound great. Easy to hook up. I listen to them when the wife goes to bed at night. They even work in another room from the base. The padded ears are a little hard to get used to, They want to fall off your head very easy. Don't plan to dance with these on.",1326240000
"07 19, 2008","[0, 0]",5.0,Excellent for the price,B0001FTVEK,718tech,A1HRECPV2Q79BG,"These headphones do exactly what they're supposed to - they free you from a cord, comfortably and efficiently. Just make sure to fully charge the batteries before you use them. If you use them with the low charge the batteries have out of the box, you'll think something is wrong. You need to charge them for 24 hours before the first use.Once fully charged, the performance is quite good. In my smallish apartment in NY, which has a lot of interference sources, I get a very good signal in every room with little to no noise. Sound quality is not as good as audiophile corded headphones (I have Grados for that), but for TV watching while my wife's asleep or casual music listening the RS120 is just the ticket, and the price is right.",1216425600
"07 7, 2014","[0, 0]",3.0,"This product started out pretty good, but is now deteriorating",B0001FTVEK,a1ac4,A2Q7GDRUXPZRMK,"This product started out pretty good, but is now deteriorating.  I recommended it to a friend, however, and he loves it.  If I do decide to get another pair of headphones, however, I will probably invest a little more, to hopefully be better satisfied.  What is disappointing is: Reception is spotty, almost requiring  its use to be within a relatively short distance from the transmitter, the fit on the head is not very good and restricts much activity, and there is very little (almost no) restriction of other sounds.  But for the price, it has been O.K.",1404691200
"06 18, 2008","[0, 0]",4.0,So far so good,B0001FTVEK,A. Bothel,AF3G5GJFCBJ65,"I have been wanting to switch to wireless headphones for a long time, mostly because of the fact that I always get wrapped up in the cords or my pets mess with the cord. I was skeptical to switch because of quality and price. However, after reading a lot of reviews, I decided to try these out. I am pleased with them so far. They have great range with little to no loss of quality in and around my house.The ONLY real negative thing I have seen (heard rather) is the Automatic Gain Control which to my knowledge, can't be turned off. If you listen to music with sudden changes, such as movie soundtracks or classical, every time you get a sudden noise, such as drums, cymbal, etc, the Automatic Gain Control lowers to volume to compensate for the sudden increase in volume, or so it thinks. This can make your music somewhat inconsistent, which can be annoying. I would imagine with more constant sounding music, it would be a non-issue though.That being said, I am still happy with my purchase, and would recommend them to someone looking to get away from a corded set.",1213747200
"01 21, 2012","[1, 1]",4.0,Good headphones but won't work for everyone!,B0001FTVEK,AC,ASVZC9DBNE92O,"I bought this headphones as a gift for my father so he can listen freely while moving around the house. Before giving it to him, i decided to try it in my house first. Plus, I new that they have to be charged for 24 hours (or 12 hours, I can't remember) before the first use, so I figured it will be better to give it as a gift when they are ready to go!First, I was very very disappointed. No matter what I did, I heard loud static noise, which was very periodic, and sounded like knocking (~ 60 knocks/sec). I tried all three channels on the base, I turned off my PC, router, every possible source of noise. I went to the basement, connected it to PC...and noise was still there. It was unbearable. Then, I realized that it could be the baby monitor. I have a child and the base of the monitor is always turned ON and it turned out that it always transmits, no matter whether the monitor itself is ON. The moment I turned off the base, the noise was gone and the sound in headphones was loud and clear. For me, this headphones would not work. I need the baby monitor. I cannot unplug it to listen to the music. However, if I did not use it, the headphones were great!I gave it to my father, and I was glad to learn that neither his house, nor his neighbors, have a noise source that interfere with his headphones. He is extremely happy. He wears them for many hours every day, around his apartment, lays down on the couch, cook with them, you name it. Today, he went to the gym in his building, which is 2 stores down from him (but right under), and could hear very well (even while traveling in the elevator). Even though he claims that he does not hear any static, it is possible that due to his hearing, he may not pick up all the noise..but who knows...The bottom line - it could be a waist of money if you have a wireless device in your home that just happen to work on the same frequency as the headphone (in my case it was a particular model of the baby monitor), or it can be a treasure, and let you truly disconnect and go around and enjoy you music, even outside of your apartment in the gym, like in the case of my father, all noise free! You have to give it a try and see.",1327104000
"04 6, 2014","[0, 0]",4.0,Sennheiser RS120 Wireless Headphones,B0001FTVEK,Acur81,A3002YH8CBT1BR,"Not sure why I hadn't looked into these before. I'm a veteran, with a high-frequency hearing loss, and not being able to hear all the dialog on TV shows, finally got to the point where I wanted to do something about it. I don't have a problem with DVD's, or Blu-Ray, as I can put on sub-titles. Anyway, these headphones have been a boon to me. I had been using earbuds, plugged into a curly cord, plugged into my stereo receiver, but dealing with the cord got to be annoying. Now that I've gotten used to the wireless, instead of just wearing them for my favorite shows, I use them all the time. Part of getting used to them, meant dealing with the weight, as these obviously are heavier than ear buds, and making sure that they're placed on the cradle properly, so that they will always be charged when you use them.",1396742400
"04 20, 2007","[7, 8]",3.0,"Not exactly wowed by these: hiss, week bass, noise, noise",B0001FTVEK,"AdamDZ ""AdamDZ""",A188S2HH77HKAN,"A mixed bagPros:- clever charging system, easy to use- uses standard AAA NiMH rechargeable batteries, not some proprietary ones- light and comfortable- decent audio for TV or quiet background music- decent stereo reproductionCons:- high frequency hiss present on all channels and can't be tuned out- weak bass when listening at higher levels to quality music sources- lacks very low bass below 60Hz, turning up EQ leads to distortion- overly bright midtones at times- open air design bleeds a lot of sound so person near you will hear your music loud and clear- looks like they're easy to break- while the range is decent it picks up a lot of interference while walking around that results in distracting pooping, whistling and screeching sounds- lacks some sort of auto-mute when runs out of range or looses tune: the noise that kicks in is oppressively loud and discomforting- annoying startup delay- volume and tune knobs too close, it's easy to  turn the tune knob by mistake and get blasted with that horrible noise - they should be on separate sides, far from each otherI'm still debating whether or not to return them.",1177027200
"07 11, 2013","[0, 0]",3.0,Ok quality,B0001FTVEK,Adam Lauer,A1LVKPR8EQ60B3,"Not great quality, Range is about 100 ft from what I have been able to test but has difficulty getting through walls.  Good to watch TV at night with your roommate or significant other sleeping",1373500800
"12 31, 2011","[1, 1]",5.0,Great Product,B0001FTVEK,adr44,A1EE9SJNPZ73IO,"My wife is hard of hearing, this product enabled her to hear TV,  It also has great sound! For the price a Great product!",1325289600
"10 17, 2010","[0, 0]",5.0,awsome!,B0001FTVEK,AgentOneArm,A2W45BZZ1Z2612,"Headset is awsome. Sound quality is great, fit great, and the abilty to charge them on the stand without having to hook up and disconnect cables everytime you want to charge them is a great design.",1287273600
"05 19, 2014","[0, 0]",3.0,"Nice , but not for me",B0001FTVEK,AGSJR,A1N8K5RXU7XCDA,"I like the sound and the stereo but I had a bit of difficulty trying to keep the sounds contained.I use the earphones so my wife can't hear the TV, but should could hear it across the room.The adjustment for the headset allowed me to give a number of positions, but didn't work still.I had to return it.",1400457600
"10 30, 2013","[2, 2]",5.0,Completely Satisfied,B0001FTVEK,A. Hearn,A3JM1TJILHPS7G,"I've had my Sennheiser headphones about 6 years and been completely satisfied with them. Just now, after much use, the plastic headband has cracked and I'm looking for replacements. Guess what I'm going to buy......you guessed it, another of the same make and model.I've found them to be extremely comfortable to wear, even when watching long movies on TV (my primary use). I use them particularly to watch TV shows in which I need help with hearing high frequencies, particularly women's voices. High frequency hearing deficiency is common with older folks like myself. These headphones have been a lifesaver in that respect.I also use them when watching high-quality musical programs. The outstanding music reproduction and stereo/surround quality of these headphones is amazing. Frequency response seems well balanced and doesn't have the high boom-boom bass of many modern headphones targeted to kids.Another use is that my wife likes to watch TV at low sound volume. I prefer higher volume. With the headphones we can each have it our way.I also like the fact that I can be watching a TV program and be able to get up and get a snack or take a bathroom break in the middle of a show and not miss any dialog. Yes, the further you get away from the sending unit, the more likely that the signal will break up but that's to be expected.In the 6 years I've owned them, I've only replaced the rechargeable batteries once, and that was simply a preventative measure, not a necessary one. I don't know how much useage is possible on a single charge because I've never had them expire. I normally use them two or three times and then put them back on the charger.I'm buying another pair and look forward to another 6 years or more of use.",1383091200
"12 4, 2012","[0, 0]",3.0,How much will static annoy you?,B0001FTVEK,AJ Hawks,A3L7HPEMZWF5YD,"I've had these for several years, and they ended up being a backup pair of headphones, rarely my primary set. I just decided to order some Sennheiser MM 400's to replace them though.PROS:* Good range, through walls, etc. They're in the 900MHz band, which does provide long range signal.* Comfortable fit* Good sound usually* Long battery life* Base station charges internal battery. I've never had to replace the battery.CONS:* 900MHz range, analog signal. It's like listening to AM radio. It crackles, if you shift your head the wrong way and hit some interference from something else, you hear a buzz, or it cuts out.* When there's no sound for a few minutes, the base station turns off and you get a loud blast of static in your ears. This happens a lot when I forget I'm wearing them and the playlist ends.* I don't like needing a powered base station for headphones. Takes up an outlet and desk space.* Constantly fiddling with the tuning nob to find the right frequency.I decided to go with the MM 400's for the replacement set, since they are bluetooth and can pair to my phone or computer, plus they have an audio cable port for airplanes, older sound sources, etc. They charge over USB so no base station. And they won't have the reception issues.",1354579200
"01 12, 2007","[2, 3]",4.0,Nice Product,B0001FTVEK,"A. Kaye ""AKAYE""",A9JHAI2Y9IKUQ,"I bought these headphones a while ago and they have been great.  Sound quality is adequate, i get next to zero static and the battery life is great too.  I would highly recommend this product.  It is a bit bulky though.",1168560000
"07 20, 2012","[0, 1]",1.0,A Total Disappointment...,B0001FTVEK,Aladdin,A1GRZLM53WSSQW,Very limited range for outdoor usage. Reception tuning is so crude. Wears uncomfortable. Definitely a RETURN. The 4/5-star reviews led to disappointment!,1342742400
"05 28, 2010","[0, 0]",5.0,Very Pleased,B0001FTVEK,Alan,A2RK96D6IJJWAE,"I bought these headphones for my father, who is in a nursing home and is functionally blind. He loves to listen to NPR and PRN and also books-on-tape. I needed a headphone that was wireless, with good sound quality, good range and a very easy charging dock. For all of these qualities the headphones delivered without disappointment! With Dad's impaired vision and some slight dementia, he is still able to get the headphones on and off without incident, and the way the charging is accomplished through the wire hoop that acts as a stand/holder for the headphones was pure genius on the part of Sennheiser!The range is good enough that he can not only listen anywhere in his room, but even as he roams the halls and the dining room! There are controls right on each headphone earpad , one for on/off and the other for volume control, which Dad has a little trouble with, but I am sure were designed to be discrete for the average user. It took a little training to get Dad to be able to find and use those switches.Dad gets daily use out of these headphones and they have brought much enjoyment to his life.Our only concerns were about accommodating his needs. The switches on the headphones are a little difficult for older, stiffer fingers, and the two LEDs on the Base unit are too small for him to see easily. But this was never designed to be a tool for the visually impaired so it's hard to really fault there.The sound quality surprised me, and I may well buy another pair for home use for myself!",1275004800
"06 14, 2013","[0, 0]",5.0,Excellent! Long reach,B0001FTVEK,"Albert Martinez ""Al_Martinez""",A2K9TLO0XXBDVT,"Awesome unit. Has 3 channel frequencies and how you get audio from it is by turning an analog tuning knob on the side like an old time headset radio, but I'm not complaining, once it's set it works great. The range is not quite what they say it is but it can still reach through 3 walls. Light and very comfortable.",1371168000
"04 20, 2009","[0, 0]",5.0,great buy - very useful,B0001FTVEK,alchemyiam,A2MNHYUXMW4KW7,Made the mistake of not reading the instructions carefully which caused me to waste quite a bit of time. Recommendation - read instructions carefully.The sound quality is very good. As previous folks have mentioned - to reduce the static/hiss - you need to increase the input power to the phones and then reduce the volume using the control on the headphones.Phones are comfortable and easy to use once setup correctly.I bought an extra set of phones and they both work well of the same RF transmitter.Wish I had bought these a long time ago. TV noise is now not a problem.I plan to also buy another RF transmitter plus headphones to run on my computer.,1240185600
"12 31, 2013","[0, 0]",3.0,Interferance,B0001FTVEK,"A. Leblanc ""The Author""",AL9MTILKJR4Q9,Liked the quality of the sound but outside interference became an insurmountable obstacle ... tried every suggested fix but nothing worked. Disappointing ...,1388448000
"04 1, 2013","[1, 1]",2.0,Disappointing,B0001FTVEK,"Alexandru Munteanu ""Saneok""",A24KI63IIV0SMV,The headphones work but there are many issues. The main one being the annoying background noise and the the even more annoying noise that starts if the headphones are not used for a while. Would not recommend this product.,1364774400
"09 6, 2013","[0, 0]",2.0,Sennheiser RS120 Over-Ear 900MHz,B0001FTVEK,AlexG,A1K08P0VYHUEVU,"Let me start with the good news :D, :a. Price is goodb. Price is goodc. Price is goodd. Sound is good - Very good - when it actually works...Now let me elaborate on that, the problem I find is it has a &#34;tune&#34; dial and sometimes (most times) you hear interference, it is sort of the price you pay for a wireless product with an FM transmitter.  Now the bad part, is you can be listening to music and you decide to browse for songs, and if you are like me you like good music with good volume, so you are browsing your folders and BAM a loud noise from the deepest darkest location of FM Hell will leave you deaf ... or at least will attempt to.  See in accordance to FC regulations Sennheiser has to shut down the transmission when it is not being used, the sad part is you will hear a loud SHHHHHHH every time it decided to shut down, and it will happen often, there is no way to turn it off, fix it nothing.. it is what it is, the only solution I have found to this is I downloaded a program that does a random sound every 40 secs or so, and it re establishes the link so the death SHHH sound doesn't get me.So yeah.. oh and Sound is good... when it works",1378425600
"11 18, 2013","[0, 0]",5.0,comfortable and very clear,B0001FTVEK,Alex L. Shelton,A3SGKKMNG4BD0X,"I use it to shield others from the tv noise at times.  It actually makes some dialog more clear!  The recharging feature is great!  Nice, light and comfortable headphones.",1384732800
"01 3, 2007","[0, 1]",5.0,Great Product,B0001FTVEK,"Alex Shochat ""shalex""",A3ED9TZ1RPJ4F8,"Perfect! Perfect and clear sound, long battery life. Receipt thru few walls at least. Charging idea is great - never in problem to recharge )compare top others where ytou need to place headphones firmly). Save battery a lot - doesn't work when no input signal.Recomend A+.",1167782400
"01 20, 2014","[0, 0]",2.0,"Worked at first, then wouldn't take a charge",B0001FTVEK,"Alfred D. Cornell ""What you think, you are""",AHSHI2N7LDX28,"This was the most expensive Christmas gift on my list, and my brother in law couldn't get it to work after the first time using it.  I'm noticing a trend with Amazon electronic sales in the high dollar range, and it's not a good one.  Apparently if you spend more than $50 on anything shipped directly by Amazon, you're almost wasting your money.  I wish I'd bought this at Walmart instead.Extremely disappointed.",1390176000
"10 15, 2009","[0, 0]",2.0,Don't expect much!,B0001FTVEK,"Alfred M. Freitas ""coffeedrinker""",A37A72Y18II54B,"When I ordered Sennheiser RS 120 headphones I didn't expect very much and I wasn't disappointed.  This company has a great reputation for sound quality but the low price caused me to have doubts.The sound quality would be acceptable if the ""hiss"" from the transmitted sound were not so pronounced.  The tuning adjustment is of some help but to tune all of the ""hiss"" out so degrades the audio quality that the device is unusable.It appears that if the audio input levels are even slightly low the ""hiss"" is very loud and annoying.  Turning the input level up does help but that defeats the purpose of the earphones (having a silent TV).  Using the audio out of a receiver with a standardized-fixed level is inadequate to control the RF ""hiss"".The fit and comfort of the headset is acceptable but don't expect to wear the headphones for an extended period.Overall the RS 120 would be a good buy but the annoying hiss detracts to the extent that I would not recommend this unit until the manufacturer addresses the noise level at low signal inputs.It will pay you, I think, to look to a different manufacturer or spent a little more to purchase a better quality product from Sennheiser.",1255564800
"10 29, 2012","[1, 1]",3.0,"Sound is good, some interference, not super comfortable",B0001FTVEK,Allan R,ANB0OKIDLNTZ,"I bought these headphones as a good compromise between something *really* expensive, and something really cheap.  For the price, they deliver a very good sound.  I'm not going to go into the sound so much, as there are plenty of reviews for that, but a few things I did find were that I concur with other reviewers that there is some interference/static.  I don't have to go very far in my house to start hearing slight static noises, especially if I go into another room.  Normally I wear these if I'm doing housework, or vacuuming, and walking around causes some annoying static.  Not enough to ruin the listening experience, but more than I want.  Also, these are uncomfortable on my head.  The ear cups are flat, not cupped, and when they are on my ears, part of it presses against my jawbone near my ear, causing discomfort after just a few minutes of use.  I was going to return them for this problem, but I find that if I turn them around, the shape of them holds them off my jawbone.  It looks funny, and there the sound is not as rich as if they were fully cupped on my ears, but it's the only way I can wear them comfortably.  Even still, as with most headphones I've found, they get uncomfortable after a few hours of wearing (they are not very light).Overall, I bought these for the wireless ability, and they work very well for that (even with some static issues).  But as a set of headphones (if they were wired), they are not that great, not ergonomic (for my head) and not very light.",1351468800
"02 26, 2009","[0, 0]",2.0,My House Evidently Doesn't Like These Headphones,B0001FTVEK,"Allan V. Luster ""Allan""",A84MZT0GMRKQW,"I bought two sets of these headphones, one for use in my bedroom and one for the living room. The first night I set them up they worked perfectly for 2 hours. The next day I was not able to receive a signal at all in the living room, although the bedroom pair was working fine. I swapped them around and discovered each pair worked fine in the bedroom, but not in the living room. I bought a long cable extension to move the transmitter out of the living room, but that didn't help.I must be getting some kind of interference from somewhere. The bedroom pair started picking up static as well after a week, so I gave up on them. I would rather have a wire connection and know I will have good sound than wonder if my headphones are going to be working or not. But you may not have the interence problems I have. When they work they are good headphones.",1235606400
"05 24, 2010","[0, 0]",4.0,Sennheiser wireless headphones,B0001FTVEK,Allen D. Glenn,A2R8EU7CYB9YWC,"I was so pleased with the first one of this item, that I almost immediately bought another. It is very pleasant to be able to hear TV and movies  without disturbing everyone else in the house. My only complaint is the off/on switch; it is hard to move on each one I bought.",1274659200
"04 2, 2013","[0, 0]",3.0,"Love the freedom, hate the squeal.",B0001FTVEK,Allyn,A2AVKGSNUB5ES5,"I bought this to practice playing bass without inflicting the experience on my neighbors. I admit to having multiple wireless electronics in the area that could be influencing the lack of clean sound. It may not be the product's fault at all. I've tried all the channels and fine tuning the frequencies, with no luck. I eventually get past the high squeal, because once the backing track is playing and I'm playing bass to the backing track, the squeal is negligible. You may have a better environment. It has been robust with no problems, charges fully on the dock and has a great sound.Comfortable ear pads and quality construction.",1364860800
"03 22, 2014","[0, 0]",5.0,Sennheiser RS120 On Ear 926 MHz Wireless RF Headphones with charging cradle.,B0001FTVEK,Al Neuman,A3HIEMJQ38283W,"I have been using these for six or seven years. ( I am on my second pair, ( nothing lasts forever )) I couldn't imagine being without them. I have had family and friends buy these with my recommendation and they are all pleased!",1395446400
