reviewTime,helpful,overall,summary,asin,reviewerName,reviewerID,reviewText,unixReviewTime
"02 28, 2013","[0, 0]",5.0,earphones,B0001FTVEK,"phyllis aber ""phyllis""",A1YORW3WNIU478,lik i have said before this set does the job for my  very had of hearing man and saves my ear drums from how loud he has to have the tv but only complaint is the stretch out after such all time use,1362009600
"02 25, 2012","[1, 1]",3.0,Made well only okay sound,B0001FTVEK,"Pickles ""Pickles""",A312KFQ78WB3A4,"I thought it would be great to have this to use with my computer and TV. I've had them about a week now and am not impressed. My last wireless headset was much better(asus travel lite) but not made as well.Sound, not great but wil work for TV. If you want to listen to music on them or watch movies I'd look for something better. The sound is very thin for lack of a better word, no depth or richness.If it's not getting a signal for awhile it seems to turn off and start hissing. Once you start sound again(unpause a show) it takes a second to come on so you miss that bit of the show sound.Interference: They do hiss unless you have the sound on your device turned up and running. They get occasional pops of hissing from unknown sources. Changing channels doesn't help. One source is the heater coming on but just turning my head can do it.It is a plus the batteries are AAA so can be replacedThey are made well but sound is just not what one would hope. Good for TV but not much else. I feel generous giving it three stars.",1330128000
"12 12, 2011","[0, 1]",2.0,You get what you pay for...,B0001FTVEK,"Pika ""Pika""",A3CKIIXNYG3CK7,"I read over reviews on Amazon before pulling the trigger on this set. I really needed it for late night PC use while the gf is asleep. I was really disappointed after the 1st nights use.Pros:- The sound has quality. I don't have a very trained ear so listening to headphones always sounds good to me.- Very light weight! Very comfortable to wear.Cons:- Static noise is very apparent. It is setup as my default playback sound on Windows 7. It is very random but when I turn on my PC the headphones blast off with static (fixed after spending 30 seconds to tune the headphone)It isn't very visible, but there is a volume button and a tune button on one side of the headphones. After I tuned correctly, it worked great. I moved 10 ft away from the source, it still sounds very nice, however, small movements of my head would generate static interference. (There aren't any other electronics between myself and the PC)- Started to get very annoying to tune the headphones every time I turned on the headphone set and/or PC.Result:Returned this item. Sennheiser's other RS headphones may be great but this one definitely is not. Using Logitech G930 now.",1323648000
"07 22, 2011","[0, 0]",5.0,easy to setup and great reception,B0001FTVEK,Pitt Sucks,A11D8B0C07ZMQ2,You can walk around my entire house with these on and not lose signal or quality.  These are great for nighttime when you spouse is trying to sleep and you want to watch TV.,1311292800
"03 18, 2011","[1, 1]",3.0,Good wireless set for the money,B0001FTVEK,PixelPusher,AC81CGJ6K9QW8,"Considering the price:  great sound, comfortable, awesome charging cradle. I'm satisfied spending $80  on this set. 1 huge drawback for me as you'll see in other posts here I'm sure...  awful LOUD static noise when signal is dropped. A few times already, working on computer listening to music, not noticing the 'silence' between songs (Pandora)... and WHAM!!! sharp static pierces my ears! Not physically harmful because I don't have volume very loud... but it's startling. Terrible design (are all wireless headphones like this?)",1300406400
"08 7, 2011","[0, 0]",1.0,Shoddy workmanship,B0001FTVEK,Piyush Desai,A2XB76T2VBY86T,I had to return the headphones same day I received because: (1) the green light would not light up power up; (2) the headphones would not seat snugly but rock on the transmitter-charger so could not establish contact with the base unless pushed down and hold while charging! Poor workmanship or inspection.  I wouldn't buy Sennheiser products again.Piyush,1312675200
"12 22, 2010","[0, 0]",5.0,Best earphones I've had yet,B0001FTVEK,P. J. Mottershead,ADC4RVGVOFO7Z,Got these to replace different brand pair.  These are the best I've had so far and I haven't had any problems with them.  Good value for what I paid.,1292976000
"03 7, 2014","[0, 0]",5.0,Very good Headphones,B0001FTVEK,"P. K. Davis ""Nana Songbug""",ANJBU16ITRA93,"We have four sets in our home.  They are marriage savers for sure when one partner is hard of hearing !  And they have apretty big coverage area so we can use them anywhere in the house.  The adjustments on the side are easy to manage, thecharging cradle is very efficient and provides a place to keep the headphones as well.  The sound quality is excellent.  Sennheiser is the best, as far as I'm concerned.",1394150400
"08 26, 2012","[2, 2]",5.0,better than expected,B0001FTVEK,P. landers,A1U33YBTU2IIU4,"Read reviews on all lower price units and problems with reception and static.  Read reviews on Amazon and other places about the Sennheiser.  The headphones work not only in the living room but i get perfect reception in all rooms on first floor of my  house.  I was not expecting that.  Only problem I had was plugging into the audio jack on my TV.  I plugged into wrong one initially.  (There are two separate and distinct jacks on my TV for audio output.)  In a review that I had read, the person said connect direct to TV so you can take advantage of playing dvd's, or instant from Netflix or Amazon, good advice.The unit works flawlessly and I have recommended these to my other hard of hearing friends.",1345939200
"02 7, 2014","[4, 4]",5.0,Has made TV-watching more pleasurable for everyone,B0001FTVEK,pnc,A183V4P6U4CFBF,"I am hard of hearing and despite hearing aids needed the volume loud when watching TV.  That's not great for other people, nor ideal when the grandchild is sleeping, etc.  With these, the &#34;out loud&#34; volume can be whatever is right for other listeners, and is separately adjustable on the earphones.  Further, the sound from earphones - at least these - is clearer than room sound, despite some good speakers from a home theater system.This may help some others, though not strictly part of a review:  my home theater receiver has an earphone outlet, but when you use it, that shuts off sound through the speakers.  The only other source of all sound is through HDMI output.  So I purchased a  J-Tech Digital (Registered Us Trademark) Premium Quality Hdmi To Hdmi + 3.5mm Stereo (RCA L/R) Audio Extractor Converter [Electronics] from Amazon.  I put this in the path of the receiver to the TV set.  It extracts the audio from HDMI (as well as pass through all the HDMI signals) and provides it as input to the headphones.  Perfect.",1391731200
"02 21, 2009","[0, 0]",3.0,Stay close,B0001FTVEK,"popie ""POPIE""",A10DQEGGFWENTM,"They fit good,are very comfortable. You can wear them for a long time with no discomfort. Battery life is very good. The controls are good as well. The one problem I have is when you get more then 30 feet away or go into another room. You occasionally get these sharp clicking, crackling and poping attacks. No matter what volume your playing them at , these attacks come in at FULL volume. But if you stay close...",1235174400
"02 29, 2012","[0, 0]",5.0,Perfect,B0001FTVEK,Port Ludlow Ken,A20CC4CZ7EL7D7,"Excellent headset! Set up was easy, very comfortable ear pads and sound quality is great. I am not an expert, but would recommend these to anyone looking for wireless headphones. My TV does not have RCA jacks out so I purchased a FiiO D3 digital to analog coverter which works great.",1330473600
"08 17, 2013","[1, 1]",5.0,Sennheiser RS120 Wireless Headphones,B0001FTVEK,Primopowers,ASCSJH31TLC3M,They are awesome!!!!  They sound great & I get no hiss.  I can walk to the garage to grab a beer from the outside fridge and still can hear the dialogue or music that I am listening too without interference!!!,1376697600
"03 30, 2013","[1, 2]",4.0,Great wireless headphones,B0001FTVEK,Pro Musician,AQ6ODF97CAHUB,These headphones work and sound really well for wireless headphones.  The only complaint I have is the noise that shows up sometimes.  It's not terrible noise but it's still annoying.  I definitely recommend these if you want wireless headphones. If not then go with wired.,1364601600
"02 1, 2009","[0, 0]",3.0,A Good set of headphones,B0001FTVEK,PSwit,A2USTPV0YH9X9U,"This set of headphones is good but not great as many reviews would lead you to believe. The sound quality is good, the fit is at best OK (they are on ear and do not lay flat) and may cause some issues with sound quality. The multiple channel feature is rather annoying and can cause a loud static session in your ear if not careful. I have become accustomed to using them but a novice user may find them difficult to use and get used to.",1233446400
"08 24, 2013","[0, 0]",5.0,Good!,B0001FTVEK,Puja,AYEZ7JVP9FJNB,"So far so good.  The battery last a long time, works well, clarity is great.  I dislike that if you pause the TV and have the headphones one, it will make this static noise and scare the crap out of you.",1377302400
"12 9, 2009","[0, 0]",3.0,Sssshhhh  !,B0001FTVEK,q-rius,A2MC05CQGEXRDS,Could have been cheaper. Not very comfortable on the ears as it does not surround the ears but sits on it. Painful by the end of the football game. Hissing sound and clicks very loud at times. Not a huge improvement over the cheaper one I bought at circuit-city few years ago.,1260316800
"12 31, 2011","[0, 1]",3.0,Edited review,B0001FTVEK,Rae,A16A8BIBGP690M,"(This original review has changed. See below) I could not get these to work with my sound system which has plug for headphones. They will not work. They also would not work on the jack on back of t.v. So thanks to comment by PriVick, I tried unplugging my sound system and using audio out on cable box and they worked. But now can't use my sound system. T.V. speakers on the LG flat screen are really bad. You have to turn up volume 100% to even hear the t.v. So now if we want to use the headphones, we have to settle for everyone else listening to t.v. speakers without surround sound system. Its not an ideal solution. Its only for the kitchen t.v. so I guess I'll keep them but will look elsewhere for our entertainment room t.v.Edit -I changed my original review after someone commented on my review which gave me instruction on how to get them to work. I now can give 3 stars because they work well and good quality sound. The instructions could be far better however. If you're technologically challenged when it comes to setting up such things and what things are called and what wire/plug should go where, then you will be lost with these instructions! If instructions were better, I'd give 4 stars.",1325289600
"04 16, 2013","[1, 1]",4.0,"good product, works, but.....",B0001FTVEK,rakesh,A1IHCWDL071ZZP,"This was a must product when i purchased it, I use to like in a small apartment and didnt wanted to wake my GF while watching tv (late night).So this product was a savior, and simple to use too.But only problem is a constant hiss sound when thr are no dialogues. I am use to it, but i am not expecting that everybody will be, so that's why 4* and not 5*.",1366070400
"02 21, 2008","[0, 0]",5.0,Hey Mom! I Finally Did Somethin' Right,B0001FTVEK,Ralph Gary Brauner,ANEU4PKHFB4E7,"Before my purchase of the 120 on Amazon I did mucho research and read a ton of reviews. You might have thought I was looking for a wife. The first thing that impressed me was these phones were  numero uno in THREE catagories on Amazon.I have a hearing problem and use the closed captions along with sound when watching TV, so I was looking for anything that would improve my aural experience.I was concered about the possible hissing sound I might encounter but I found I could eliminate it in short order by experimenting with volume source and fine tuning.As I write this review I am listening to a cable music channel on my TV and I am one happy camper. Sounds real good.I have tried using these cans with the television speakers turned off and just having the sound come through the phones and also with the speakers on at a moderate level.I find the latter offers a fuller dimension of sound because these cans are open. Besides I am a party of one and get no human static for any volume issues.As far as the fit I have never owned a set that did not make its presence known to some degree. I rate these decent in that arena... but not out of this world.Overall I believe these are worth a serious look see. Excuse me now while I get back to my music.",1203552000
"08 2, 2009","[0, 0]",5.0,Hearing is Believing,B0001FTVEK,Ralph Jarmon,A25I3EHAJTDAAM,"I think these are a great headphone deal, cost to value wise. They are very simple to hook up, excellent sound quality, no static, no hiss, excellent head fit adjustment, lightweight and comfortable, and easy to use recharger. I read a few complaints and have to wonder if those people are expecting something too extraordinary for this price. It is an excellent value for anyone but the pickiest of consumers. Of course, if you are expecting the world from these headphones then perhaps you should buy a 3-400 dollar set. But this set should satisfy most people's needs.",1249171200
"10 26, 2013","[1, 1]",5.0,Good product,B0001FTVEK,"Rattler ""Bob""",A3JQDX6UB87982,Really like these headphones. Great sound! Item dies what its meant to do. Works fine.Item dies what its meant to do. Works fine.Item dies what its meant to do. Works fine.,1382745600
"11 9, 2006","[3, 5]",3.0,Pick better options,B0001FTVEK,Ravi,ABS6N8TJE5DMB,"The sound quality is excellent. One drawback was the headset slips off the head. If you want a wireless headset go for a bluetooth headset so that you dont have to have the RF transmitter. I got a Blueant X5 and am very happy with the sound and no wire and no transmitter freedom. I later bought a Sony MDR-V700DJ, a wired one, to just blow my head off.",1163030400
"08 17, 2010","[0, 0]",4.0,Wow! This works great!,B0001FTVEK,Ray LeCara Jr.,A2HN8MZJU7QE58,"Even though the reviews were mostly positive, I was skeptical and held off purchasing the Sennheiser Wireless Headphones until the last minute.  Now that I have had a chance to use the headphones, I couldn't be happier. They're comfortable and the sound quality is quite good. I wear the headphones when I am out in the yard and want to continue listening to my favorite music channel.  At night, the headphones come in handy when I don't want to wake anyone up.Update: January 2012After using this headset for a year-and-a-half now, it still continues to come in handy and works fairly well.  My one complaint is that the volume is a bit sensitive.  Sometimes I need to switch the unit off and then on again to get the volume to work.  Other times I need to press onto the volume dial to get it to work.  Quirky things, to be sure, but I am hoping they aren't indicative of a bigger problem yet to come that may render the headphones inoperable.I've reduced my five star rating to four based on the events of the past year that were described above.",1282003200
"12 8, 2011","[0, 0]",5.0,Great Sound and comfort!,B0001FTVEK,Ray w,AWSGW35X1UY1I,These wireless headphones are the greatest.  I purchased them for watching TV and being able to here while there is noise in the room produced by a loud 4 year old.,1323302400
"01 21, 2008","[0, 0]",5.0,Good buy!,B0001FTVEK,Razzoo,A1W9U13YPP81KA,I bought these Headphones for my Dad for Christmas and he has just raved about them ever since.  No interference and very comfortable.  I tried other headphones like Sony and Phillips and the price was over $100.00 plus they were so uncomfortable.  The Sennheiser headphones are nice and soft on the ears and are easy to re-charge.  I would definitely recommend these headphones.,1200873600
"11 27, 2009","[1, 1]",3.0,comfortable but too loose,B0001FTVEK,R. Boyd,A29NGWGVODLMRS,"If you want to sit back and relax while listening to music or watching TV, these are great headphones.  They even work OK for moderate activity as long as you don't lean forward or bend over.  A simple strap around the back would have solved the problem.  I think the sound and range is excellent considering the fact that they are wireless, and the price point.  For a few hundred dollars more, Bose probably makes something better.  The loose fit actually adds to the comfort but don't lean over the pool or the toilet.",1259280000
"04 27, 2011","[0, 0]",4.0,Is a good TV watching headphone with a caveat,B0001FTVEK,R. Bruno,A1UOFCAP9SCKH5,It works well watching TV in bed. My only problem is that they should make them with cupped ear pads. The ear pads are flat and slide off or down quite a bit when moving the head that's prop with pillows. I ordered from Electronics Expo since Amazon didn't offer at the time. Would order again from them..,1303862400
"01 27, 2012","[0, 0]",4.0,Great sound but abrasive to the ears,B0001FTVEK,"rcbuzzby ""rcbuzzby""",A2Y6YYPH84E0IQ,"The sound could not be better once you choose the correct channel from four choices .... no big deal.  Distant reception is better than expected.  I can keep them on and move between rooms during viewing breaks with no issues.  My only con is they are not soft on the ears.  You know, comfortable.  To wear them for an extended period of time needs breaks on the ear's skin.  Kind of like flat rough foam pushing on your ears...hey but for the price and the quality sound, they're great.  Thanks kids!!  Great present for your tech/gadget freak Dad.",1327622400
"05 7, 2013","[0, 0]",4.0,Good quality for the price.,B0001FTVEK,"R. Cherye ""rcherye""",A1XHPJYUEAVO7A,"Bought these for watching DVDs and movies that aren't closed captioned since I suffer a slight hearing loss.  So I'm not critical about music quality or roaming capability, though they are more than acceptable in both categories. They're great for what I bought them for.  They are a little large for small heads, like mine, but you can wear them tilted slightly forward and they're comfortable, but will slide around if you move about.",1367884800
"06 18, 2008","[0, 0]",5.0,As promised,B0001FTVEK,"RDR ""RDR""",A8ATC5S7R11IT,"Works well, and as promised. The only negative - it is a little heavy and doesnt 'hold' to your head very well. I use this when I walk on my treadmill and am watching TV at the same time, and it keeps slipping off my ears. Not a big problem though, and I wish they had created a method to increase the tension in the headset mechanism so it would hold tighter. The sound quality is good - if it doesnt come through well, there are 3 channels I can try. Between all 3, at least one comes through well.",1213747200
"12 10, 2012","[0, 0]",1.0,Not easily hooked up.,B0001FTVEK,"R. E. Gottschalk ""Literary Lutheran""",A3VYRP0A5864TH,I couldn't get this to work with my Bose system.  The connections were not flexible enough for the system that I have.  Granted my Bose system is 5 years old.,1355097600
"12 31, 2011","[1, 2]",1.0,"Clicking sounds, too big for my head",B0001FTVEK,"Renae Gregoire ""CarolinaRen""",A3QJFOLL5KGS8H,"I knew I was taking a chance ordering these headphones, as other reviewers had mentioned that they are wide and they still had problems with hissing / clicking sounds. Well I had both of those problems as well. The headphones are very wide -- they feel way too loose and when I bent over for any reason (I wear them while cleaning / doing laundry, so I bend a lot), they promptly fell off of my head. Terrible -- don't know why they're not adjustable that way. Even if so, I'd still be unhappy with the reception -- our home is 2600 sq ft, and I had lots of areas inside where there was hiss and clicking noises. Oh well. I never would have known unless I tried....",1325289600
"11 28, 2011","[2, 2]",5.0,amazing sound,B0001FTVEK,retdatlast,AVV664GID1Z13,My husband has had wireless headphones for watching TV for years.  He has a bit of hearing deficit and without headphones I could hardly stay in the room because the TV had to be so loud. I had purchased him several different brands over the years.  I recently purchased him the Sennheiser 120 and there is absolutely no comparison in the sound quality and comfort!  They are so amazing I purchased a pair for myself for the bedroom TV and my daughter and granddaughter for Christmas.The product was delivered when promised and in great condition!  Thank you Amazon.,1322438400
"04 3, 2009","[1, 1]",4.0,Nearly Perfect,B0001FTVEK,"R. Evans ""Rocke""",A2C09XLWF45EIP,"Don't let the title fool you. I love these things. Unlike some of the other comments, I have had nothing but crystal clear sound from the moment I turned them on. I have even gone outside with them a short distance from the house and the sound is still clear and that with the base unit stored in the cabinet underneath the TV. I seldom get any interference. I will say that currently I only use the phones to listen to the TV. I haven't tried to use them in an audio, PC, or gaming application. At this point in time, I have the base connected to the audio output connectors on the TV.There are only 2 issues I have. The more annoying one is the fit. With the Sennheiser name, I thought the fit would be better. They ""toe in"" toward the front of my head creating pressure points just in front of my ears. After wearing them for a short while, this becomes less noticible but it is still there. The second is a burst of static when I pause the Tivo receiver I have for a few moments. I normally get around this by just turning the headphones off when I'm not actually listening to something (I do the same when a commercial comes on and I'm watching Live TV). The on/off switch is getting a workout and we'll have to see how it holds up after a period of time. Of course, taking them off works pretty well too.Pros:. Clear sound/great reception. Good range. rechargable batteries. quiet house for the rest of the family. better acoustics for the listener. PRICE (this is an exceptional price for this unit)Cons:. Uncomfortable fit (at least for my head). Annoying static during pauses",1238716800
"10 10, 2011","[0, 0]",5.0,Wireless Headphones,B0001FTVEK,reviewer,A2X3TOL5HAU6OA,"This product is as good as they get. Not the most expensive but certainly the top level of quality. Easy to use, basically plug in and go. The vendor delivered right away in a strong package. If this is an idea you've been looking for, this is a good product to buy",1318204800
"02 24, 2012","[1, 1]",4.0,good,B0001FTVEK,"reviewinator ""MJ""",AG26KTDIMS9MO,I have had these for 2 years and they still work great. The one con is that you can't move your head much (especially down) or they will slide off your head.,1330041600
"06 4, 2010","[0, 1]",5.0,Excellent product,B0001FTVEK,R. Gomez,A5BL0WEGV1P03,I've purchased many wireless headsets over the years and have yet to find one that actually works.  Until now.  I just moved into a new home and the layout prohibits me from having a wired headphone going to the media center so I researched and decided on this one.I don't want to rehash all the positive reviews because I agree with them all.  I set it up this morning and was able to go all through my house and out to the furthest point in my back yard (approx 150 feet or so) with great quality.Very happy with these.,1275609600
"01 5, 2014","[0, 0]",5.0,FInally Can Listen to TV in Peace,B0001FTVEK,R. Guerena,A3RF5L5NIAPEH,I love these headphones.  The range is awesome and the sound is very clear.  I use it for TV and instead of a headset for Xbox.  I am very pleased with this purchase and highly recommend it.,1388880000
"12 5, 2010","[1, 1]",3.0,It was a dark and stormy night...,B0001FTVEK,"rhj4 ""Bob""",A3S90CB04IYO50,"Product works well, but it is a bit bulky on my head and it weighs too much. I would prefer something with a smaller ""headprint"".",1291507200
"02 8, 2010","[0, 0]",5.0,Great wireless headphones,B0001FTVEK,Richard,A2XXW6M0RA27EG,"I got wireless headphones to allow me to watch TV and play video games after the family has gone to sleep/before they get up.  For this purpose they are excellent.  The sound quality is phenomenal.  I was able to hear sound effects in games that I didn't realize were there!  They remain connected throughout my entire house without interference and were easy to setup.It did take a little feng shui to position the base unit away from the entertainment center for a clear signal.  Also, I find the quality of sound the best if I turn the source volume up high and the headphone volume low.",1265587200
"10 4, 2009","[0, 0]",5.0,Best bang for the buck,B0001FTVEK,Richard,A2NN765NTRCFP7,"I have gone through many headsets over the years, mostly wired. This is the absolute best bang for the buck I have ever experienced. The set works as advertised. and puts out sounds that I have not heard on more expensive sets, example, in the game Call of Juarez, Bound in Blood I now detect the faint sound of spurs when the character in riding a horse. I have never heard this sound before. I have not detected any static whatsoever. I very much like how I just turn the headset off, place it on it cradle and it recharges the batteries for the next day. I have had some all day sessions and the batteries have not failed once. When you consider performance vs. cost... WOW",1254614400
