reviewTime,helpful,overall,summary,asin,reviewerName,reviewerID,reviewText,unixReviewTime
"03 18, 2014","[0, 0]",4.0,Ear Piece Problem Solved,B0001FTVEK,drnox,AYRBBREH7O3SO,"I had an 10 year old pair of wireless headphones that I wore to listen to music while I worked around the house. I dug them out of the closet and started wearing them for listening to the TV when I was working around the house. It was nice to still be able to hear the show when I was doing dishes or in the next room or whatever. The hiss was pretty noticeable, but still range was great and I was just listening to TV, so it wasn't that big of a deal.My mother lives in a retirement home and, due her poor hearing, struggles to hear the television (so she always has closed captioning on). I figured a set of wireless headphones for her would be a pretty cool gift and I could test drive them to see if I wanted to upgrade. So, I bought the RS120s. The sound quality was much much better than my old set. Almost no hiss at all. Cool. I set them up at mom's. The first thing we heard was a neighbor's telephone call (this was pretty much crystal clear too). I guess they had an old 900MHz telephone. That was only the first night though. After that, it wasn't a problem. She struggled with the philosophy of tuning the headphones to the base thing, so I bought her a set of the RS160s (and I took the RS120s).The RS160s weren't as convenient for charging (she has to plug them in as there is no charging stand), but there is no tuning involved (you just have to pair them, but that is not hard). Another key difference is the RS160s are over-the-ear headphones (an outer foam ridge that goes around the ear), not on-the-ear headphones (a flat foam pad that lays on the whole ear) as with the RS120s. You can see the difference when you look at the pictures, but none of the reviews I read mentioned this. This is a huge difference to me. Over the ear headphones cup your ears and stay on if you lean over. On the ear slips off even if you bend slightly forward. Major pain when you are working around the house. Unfortunately, while the RS160s don't suffer from this same drawback, they don't have the same range as the RS120s - they sound absolutely great when you are in the same room, but start cutting out when you get much further away (and since they are digital, they don't just get more static, they cut out).So, I compared the size of the ear pieces on the RS160s with the RS120s and they were pretty close. Close enough that I decided to drop $12 and buy a set of replacement RS160 ear pieces and put them on the RS120s. They got here today. It was a breeze. I just pulled the old earpieces off of the plastic piece that fits into the phone and put the new ones over. They are slightly bigger and not exactly the same shape, but I put a couple pieces of cellophane tape to hold them onto the base before I put the earpiece assembly back on the headset. You would never know they didn't come this way. Best of all, they stay on and I get the range of the RS120s. Why Sennheiser didn't make them this way, I have no idea. So much better.Link for replacement ear pieces below.http://www.amazon.com/gp/product/B00DEYA5UO/ref=oh_details_o00_s00_i00?ie=UTF8&psc;=1",1395100800
"06 20, 2012","[1, 1]",5.0,I love this product!,B0001FTVEK,D. Roberts,A342ZILZJ260ST,"I read most the reviews before ordering my Sennheiser wireless headphones with charging cradle.  We have three TV's, but I only wanted to order one to test it out.  My husband loves listening to sports on the living room TV set and I am not a sports fan.  I would often ask him to turn the TV down and he would get annoyed at me.  I bought this for that TV and he hooked it up.  At first, he did have static in the earphones. But he had the living room TV hooked up through his giant speakers that he also uses for his CD Player.  I suggested he take the TV off those speakers and just let it work thru the TV speakers.  When he did that, there was absolutely no static.  The sound is terrific, clear, and the earphones are very comfortable to wear.  Now he can watch sports all the time and not bother me.  Also, our house has an open floorplan and the kitchen opens to the living room.  I like to turn on the kitchen TV to watch news when I am cooking.  He dislikes hearing that set.  So I ordered a second Sennheiser set for the small TV in the kitchen.  Now I can watch news and work in the kitchen and it doesn't bother him.  I credit this product for saving our marriage from discord over different tastes in TV viewing.  I was so happy with the product that I ordered a third set for the library TV.  They are real easy to hook up and all three worked perfectly with clear sound and comfortable to wear.  If someone in your house plays the TV too much or too loud, this is a perfect solution, and very reasonably priced for the quality you get.",1340150400
"07 28, 2011","[1, 1]",3.0,My Accurate Review,B0001FTVEK,Dr. Penrose,A2IDM0KG1I54WG,"Just got these yesterday. Read instructions, put batteries in and let it charge for the full 24hrs before I used it.The good on power:I have had no issues with charging so if any review complaining of that is experiencing this later in the product ownership there is nothing actually preventing you from charging it. Yes if you move it a little off etc it stops charging but if you just sit it on and leave it there with the charging confirmation LED you are fine. It works as intended and is very convenient. Also a plus is the ac adapter which apparently is designed to consume less power than needed.The bad on power: It said in the instructions you must charge the batteries for 18hrs subsequently after use. I have no idea why they say this or if it's even true but this was misleading to me. I only throw it on the charger when i'm done with it and use it when I need to. As for battery length I have been using it for almost 8hrs straight so far with no problems I will update how long it takes until it dies out following the 24hr initial charge cycle. It sucks that there is no option to charge a separate set of batteries while you are using the headset off the charger because once they die, what then? It's a wise investment to get the best/right battery upgrade with independent charger. Make sure you never use anything except rechargeable tripe a's as per the instructions.The good on comfort/design: This set seems sturdy and has a very acceptable build quality. They are more aesthetically pleasing than the other models in my opinion. They are also very comfortable which is great for extended use.The bad on comfort/design: The trade off for comfort is that these do not clam onto your head at All. They are built ""wide"" and are just really bad at staying fit. Any jarring or thrusts in any direction, especially if you have a head of hair will uncomfortably shift them forward and back off your head. This was very inconvenient and also prevents using the wireless benefits in a lot of situations such as on a tread mill where you would need it to hang on. This was a loss in star alone. I understand it's a trade off but I would have settled for a more snug fit and sweaty ears then such a loose fit. Some may have a fatter head to put it bluntly and not experience this as much or come to appreciate the design in that case but I have a nice size normal head and it was just not good enough. Others have commented on this.More: The biggest fail on the design that equaled another star for me is how amazingly loud the open ear design is. It was the very first thing I noticed. If you blast these or literally have them on any sound level they are COMPLETELY audible to anyone in around you or in passing distance! This is terrible to me. Even the cheapest pair of headphones can contain the sound to a personal distance. I do not see the purpose either. It's not like you can hear anyone with them on a fair volume level anyway, so why not make them like enclosed cans? This is just unacceptable to me.The good on reception: I have went a pretty far about 150ft on the 1st floor with the transmitter on the 2nd and have had great clarity with these. I enjoyed that a lot. I always get it in the middle of the ""beginning and end"" of the loud part of the tuning knob and that works best.The bad on reception: This was another star off. The reception can be very finicky. What I seem to experience is the further I am away from the transmitter the Better it is! I cannot explain this. There is absolutely no interference as I turned off everything except the WiFi (which could be the issue) and you would think being closer would be better but I guess it's like a WiFi network where too close is bad. I am within 5-8ft of it and cannot make it farther because the cabling provided will not allow for that. I am just really disappointed with the clarity. I mean the slightest shift in movement or turning your head is accompanied by distortion and crackling or static. Mainly static. I have tried every one of the 3 channels to no avail. I find myself having to find a spot and staying fairly still.The reviewers claiming a hissing are absolutely correct. I have the audio sources on max and the headphones on medium and when a track comes to an end there is a definite hissing sound as you would hear in your car while on max but much more audible. It's not quite obnoxious but definitely noticeable. I find it unappealing and being someone who has always wanted to try Sennheiser products this certainly was a sad experience in that regard.I will be returning these and chalk it up to wireless headsets being an unrefined technology. I will be testing the more expensive ones before I rest my case, specifically the 130s and the 180s. I am hoping I will have a better experience with the 130s. These 120s seem more or less just entry level. I wouldn't even touch anything less than this model. I really wanted these to work because I had every intention of keeping them before I tried them. I cannot say enough about the freedom from wires. I am so tired of tripping and yanking the laptop about while catching myself. It doesn't happen that often but that benefit plus not having wires all over me is very liberating and I believe most reviews are based on this luxury and not the clarity/quality which must come first. I'd much rather have a wired set that was clear and loud than one that ever ever crackled or hissed or had static more than once per 30seconds to a minute depending on how much I move.*I must admit I experienced a ton of clipping when blasting music and more than lacking bass and sound quality but this is 95% unlikely to be the fault of the headphones since I was using it with a Vostro 1510 with on board sound; i.e. my system didn't have the necessary power to drive the hardware. I would really enjoy a wireless usb headset from Sennheiser since it would by pass the on board chip. I don't know if that's an available option or not.Final words: I remember reading about auto-tuning adjustment or something regarding volume on these I believe. I have noticed how songs shift in volume during the beginning or end of a song on occasion. It is irritating to have it essentially override my volume setting and it's not very intelligent. If someone can shed more light on this that would be nice. It doesn't happen too often but I don't like it and would like to turn it off somehow.*UPDATE: I have since tried the headset while watching an online TV show and am happy to report a great majority of the distortion and reception issues weren't present. This indicates that my on board sound processor is in fact the cause of much of the crappy sound. It just doesn't have the power to push music files hard enough to drive what these headphones can handle. I am assuming media files require much more power especially for .FLAC compared to a simple video audio stream. I am going to test it with a movie tonight and report on that but I experienced only 1-5% of the static issues when moving around while watching and I had to purposely try to. Before I had experienced 50-70% occurrence of static when moving even a little. Moving the transmitter off the floor and onto a table also helped a lot. Mounting it to the wall is convenient and recommended, it has the recessed hook built in just no hardware.P.S. I have raised the rating to 3 stars to reflect this development.",1311811200
"01 9, 2011","[0, 0]",3.0,substandard headphone design,B0001FTVEK,D. Swift,A2WL349JI5LCWX,"Sennheiser is an excellent company. We retired a previous Sennheiser wireless headphone kit after 10 years of service and replaced them with the RS120. The sound quality and range is appreciably improved but I'm sorry I didn't look closely at the RS120 before buying. The headphone design is poor.Our previous headphones had swiveling earpieces and earcups. They stayed in place as you moved about. The RS120 is a more basic design -- no swivel, flat stiff earpieces. The headphones only stay in place if you remain still and vertical.I recommend Sennheiser wireless phones but look at the RS140 and up.",1294531200
"10 30, 2005","[24, 26]",5.0,I love them...I'm buying another pair!!!,B0001FTVEK,D. Ticzon,A201BT0O9E1CSN,"After using my first pair for the past 6 months, I have decided to buy another set. I have my current set connected to my computer. The second set will be connected to my surround system so I can watch it with my 56 inch Samsung DLP TV.Now with two pairs, two people can watch the TV without waking up anyone else in the house.The range of these headphone are very far. I can go into my garage, and empty out the garbage without missing any of my music as I listen to my music collection on my iTunes.The base charges the batteries without any problems. I am still using the original batteries, and they still hold a good change so I can watch several movies with doing a rechange in between the movies.I'm sure you will love this headphone as much as I do. With the price, you can't go wrong.",1130630400
"01 12, 2005","[129, 140]",4.0,I'm impressed!,B0001FTVEK,Dubbie,AAGVCLVJPXRSJ,"I have this habit of getting up early in the morning well before my wife and was getting tired of having to keep the volume down on the family room TV before she got up.  So I was just looking to use these headphones for TV use.  However, out of curiosity, I walked up stairs and clear across the other side of our house and outside of some occassional hissing, the signal was still strong.  Given my intended use, signal strength, clarity, ease of use and value were the primary critieria and the RS-120 has met or exceeded my expectations for each of these criteria.Just a few other comments: 1. The comments of how you need to retract the headphones to allow for charging is true, but this really isn't a big deal in my opinion, and is more than compensated for by the ease of the charging mechanism which simply requires you to set the headphones down on the base.  2. The receiver automatically turns on when it receives a signal and turns off after a few minutes if the signal stops.  This was a pain when I paused a movie for a while and had to turn the TV off and on again to get the headphones restarted.  I'm not sure why simply turning the movie back on didn't do the trick since it resulted in a new signal????  However, the upside of this set up is that you don't always have to remember to turn off the base unit on your own.  3. The headphones have it's own on/off switch.  4. There's a volume and fine tuning adjustment on the headphone that can easily be adjusted without taking them off your head.  The set up is very intuitive.  5. Contrary to some other reviews, the pair that I received came with two adapters that allowed for easy connection to a standard headphone outlet or computer.Bottom line, I did a lot of research before purchasing the RS-120 and I am still very satisfied.  Unless you want to spend a lot more money, everyone should feel comfortable with this option.",1105488000
"07 26, 2013","[1, 1]",5.0,Good for the price.,B0001FTVEK,Dude,A3MQU9GXW89HKL,Great for watching TV. These aren't Grados so don't expect audiophile sound. Light weight and comfortable for a couple of hours.,1374796800
"04 20, 2011","[0, 0]",4.0,"I really like these headphones, with a couple small reservations",B0001FTVEK,D. VanAntwerp,A3TE284VFHUTAW,"I purchased these Sennheiser RS120 headphones to hear the TV without blasting my spouse out of the house. Because of my hearing impairment, I would normally turn the TV all the way up to 100% volume.I do like these headphones. I can now hear the TV nicely at 25% volume. I wear the headphones for hours very comfortably. Sound quality is good. Reception is excellent anywhere in the house. Automatic recharging of the batteries is ingenious! I enjoy these headphones. Buy a set for yourself!Here are my two small reservations:1. The instructions are not complete enough for a person who isn't familiar with hooking up electronic devices. I would prefer a more definitive set of instructions. For example, the power supply was buried in the packaging. Nowhere did the instructions say to look for a power supply and hook it up. I thought maybe the power came through the audio cables. What do I know? Also, the instructions do not give any clue where to connect the wires to the TV.2. My TV is about 10 years old - still analog. Therefore, the volume of the headphones is directly related to the volume of the television. If the television is muted, the headphones are muted. If the television volume is low, the headphone volume is low. So to use the headphones, the television volume needs to be a little bit louder than my spouse would like. If we get a new digital TV, this will no longer be a problem.I love being able to actually hear the TV without being constantly told to turn it down. Buy these headphones. You will like them!",1303257600
"11 18, 2009","[0, 2]",1.0,I Don't Understand,B0001FTVEK,D. Wolf,A2ED2S3APUJCWD,"I don't understand the high ratings for this product.  I have these headphones, and I have a Rocketfish set.  The Rocketfish set looks terrible; I thought these would look less conspicuous, and they do, but the sound quality--the only thing that really matters in the end--is terrible.  That is to say, the sound quality is great--what you can hear of it beyond the steady background distortion which goes away only for seconds at a time but is otherwise always there.  I can use these to listen to the TV when I don't really care about the experience of listening--I just want to hear what people are saying.  But I cannot use these headphones for watching movies when I want to hear all the nuances and all the background sounds, like a surround sound.  I think one star is too high for what I purchased these for.  Take my advice, go with Rocketfish!",1258502400
"01 11, 2014","[0, 0]",5.0,Defies physics,B0001FTVEK,DZiem,A2GV8R6KRD40AO,"These headphones sound great and they actually work a lot farther away than you would expect.  I have to pull the headset off a little to hear for outside hazards, but I can walk outside of my house (brick/lead construction from the 1950s) and still hear my music.",1389398400
"06 12, 2011","[0, 0]",5.0,Great wireless phones,B0001FTVEK,eagle2352,A3ISVYONRK0TPQ,"I have only had these for a couple of days and I have not seen one of the negative review issues that have been previously mentioned regarding hiss, drop out, or silence resulting in a disconnect. These replace a set of reconditioned Sony head sets that my new rescue sort of beagle enjoyed. Out of the box you simply install batteries and hook up left and right inputs in to TV, and plug in base unit...no directions are necessary, it is very easy.  The unit includes, converter to phono, and also a mini plug.  They have a soft flat ear piece that is very comfortable, not sure they will stay on if you are jogging but not doing that a present, will let you know if that becomes a problem. I read that several people had problems with back ground hiss during quiet scenes, in my expereince this is not an issue, this hiss is just not there, and the sound is remarkable. You quickly discover not all tv has high quality sound, and some dramas have so much back ground ambient, that it could sound like a hiss, but it's the party in the next room, or the street, or rain, or whatever, but it is not being produced by the head sets. During a quiet scene the head set does not turn off, I have paused it, and the result is silence and as soon as you start it back up the sound is there. Perfect, a real plus for those of us that are hard of hearing.  The charging station is well designed as you simply store ( hang)the head set and it charges. The unit has over charge protection. My old set had one nice design feature,  when you put them on they turned on, this design has a switch.. on and off. Not an issue. The tune and volume are close together, you get use to where the volume is and you only have to tune it once.  I got all the way to other side of the house and then walked outside a bit more and could still hear the TV clearly. So range is not an issue. Good set , well priced, hope you enjoy yours as much as I will enjoy mine..",1307836800
"02 2, 2011","[0, 0]",5.0,Great for hearing impaired,B0001FTVEK,EBOB,A1Z2G0MN861KSU,"This is not one of those technical reviews where I've researched dozens of wireless sets and this one is the best. I've only tried this one, and was given it as a gift from my son, so there may be better options. I had been using my old Sony wired headset for years because I thought they were top of the line.  Behold, when I tired these I was amazed at the sound quality -- and I am fussy.  Excellent bass, very natural sound overall. Without phones I have trouble understanding TV dialogue, but when I use these I don't use subtitles, even when there is background music.  The wireless aspect is great -- I can get up and make coffee, etc., without being tethered to the set. The charger sits in back of my TV out of sight. They are so comfortable I forget I have them on.  My only regret is that I haven't had these earlier. Very well worth the price.  As I say, there may be better options, but I am a happy TV watcher.",1296604800
"04 27, 2014","[0, 0]",2.0,Max volume is still too low,B0001FTVEK,EBO,A3HU8PJOJAPNJB,"Too bad.  Otherwise I would have kept them.  They were purchased for my wife who has been using TV Ears for a couple of years.  She put these on with the TV, turned up to max volume, and took them off all within five minutes.",1398556800
"02 27, 2005","[6, 7]",5.0,Performance Headphones,B0001FTVEK,EdBianc,ASYKL6576DHRG,I purchased these headphones after using (and returning) the Sony MDR RF960's and have been totally happy with the performance of the Sennheiser unit. The range is excellent and there is no hiss or distortion in the reception. The fit of the headphones is good and the ear piece is comfortable. For the price I paid ($72) there is no question this is a best buy!,1109462400
"05 13, 2013","[1, 1]",1.0,Disappointing quality,B0001FTVEK,Edgar H. Bork,A19EL8W7G03BYR,"Not worth the money.  I've been an audiophile for 40 years and a fan of Sennheiser for many years.  This product is a poor representation of Sennheiser quality.  I plug it into a high quality Denon receiver's headphone jack and sit no more than 10 feet away from the transceiver and get poor sound quality at best, regardless of which of the three channels I chose or what tuning I select.While the headset is reasonably light, the ear cushions are not comfortable for any length of time.  They feel like wearing drywall.What really makes me hate this product is the unit's propensity to produce sudden and high volume noise without me moving my head.  Unpredictable and potentially ear drum damaging.  Imagine listening to your favorite music or TV show at 60 decibels then ALL OF A SUDDEN hearing a pop of 110 decibel noise.I am close to sending this back for full refund.  I will try a few more positions for the transceiver, but doubt it will help.I'm really sorry I bought these, and my respect for Sennheiser has degraded, even though I have two other Sennheiser products in my possession.Do NOT buy this set.E.H. Bork",1368403200
"06 13, 2011","[1, 1]",3.0,"Meets the need, but little else",B0001FTVEK,Ed Seith,A1U4I9NTIU4WI9,"I've had this product for almost 18 months now, and it's a love/hate relationship.  I use them primarily so that I can practice guitar at all hours without disturbing my family.  They allow me to do that, with some caveats, which is the only reason they're getting a positive review.  Battery life is good, and they're generally easy to use, but there are MANY cons:1. Sound quality - overall quality is not too bad, but bass response is very muted, which takes a lot of the ""life"" out of listening and playing.2. Noise - just about ANYTHING interferes and injects a hum, warble, or some other minor distortion. 99% of the time I am less than 5 feet from the base.3. Auto-off ""feature"" - if a loud-enough-for-its-own-taste signal is not received for a moment or two, the receiver portion of the headphones shuts down, prompting a HUGE and LOUD steady-static burst that hurts the ears.  This is plain STUPID engineering, and might be the biggest reason to avoid these. It's horrible.4. Ergonomics - the earpieces are flat, and not soft.  The phones will slide off your ears and head with relative ease, and are almost, but not entirely, uncomfortable.All that said, they are easily the best wireless headphones I've found in the relative price range, they remain durable and usable for the purpose, the charging/holding stand is brilliantly executed and easy to use, and they allow me to do what I bought them for.  Meh.",1307923200
