reviewTime,helpful,overall,summary,asin,reviewerName,reviewerID,reviewText,unixReviewTime
"09 8, 2011","[1, 1]",4.0,Amazing deal for the price,B0001FTVEK,J. Reed,A1TGBDVX3QXCRH,"I have been through two pairs of wired Sennheiser headphones.  I have a pair of EH150s that I absolutely love, except for the cord.  So when I wanted wireless headphones, I immediately looked at Sennheisers.  I use these exclusively for TV and video games.  I don't listen to music with them.  I'm also not moving around a whole lot.  For me, the point of these is to play video games and watch TV at night and not have a wire running from the TV to the couch.  And for that, they do the job perfectly for the price.As other reviewers have mentioned, the base station automatically detects when there is and isn't a signal and turns on and off accordingly.  Some people have said that the signal randomly cuts out during when what they're listening to is very quiet.  I have not had any issues with this for video games, even in very quiet parts of the game.  The auto-turnoff time with no signal is 3 minutes, which is very reasonable.  So I suppose if you're watching TV and you mute it during a really long commercial break, then yes, the headphones will turn off.  ""Don't do that.""Other people have mentioned hiss.  This was a problem for me when I initially set up the headphones, but it's easy to work around.  First, play with the tuning knob on the headphones until the signal is at its clearest.  Then, mute whatever you're listening to, and slowly turn down the volume on the headphones until you can no longer (or just barely) hear a hiss.  Then unmute your source, and turn its volume up until it's at the level you want.  Problem solved, no more miss.  I think people who complain about the hiss are turning the volume on the headphones way up instead of turning up whatever is plugged in to the headphones.There are two things prevent me from giving it 5 stars:- the connectors are RCA.  They include an RCA-> 1/8"" stereo adapter, and a 1/8"" to 1/4"" adapter, which is great, but is rather bulky sticking out of my receiver.  I'd rather have a 1/4"" plug, and adapters for 1/8"" and RCA.- the headphones are not as comfortable as I'd like.  Don't get me wrong, they're great for what they are, but compared to me Sennheiser EH150, they're noticeably less comfortable.  I can wear the EH150s for hours and not feel like I have anything on my head at all.  It's not the weight or bulk of the wireless headphones, it's that the earpieces and covering fit less well and are less comfortable.  (And the EH150s were $20 headphones, so it's not like they were luxury items or anything)Overall though, for the price, they're great and the best choice among similar brands in this price point.",1315440000
"12 18, 2007","[0, 0]",4.0,Good quality and great price...without wires.,B0001FTVEK,J. Salce,A1D2CTV489Z5QE,"I liked:This model is very comfortable and lightweight. Great sound quality (it sounded as nice as corded headphones) and it has a volume control built into the unit. The transmitter has a nice range and also charges the headphone battery.Unit automatically shut off after a few minutes if no audio is going through them, but it also has an On/Off switch, some might prefer to turn it off manually.Low priced compared to other less featured headphones.Didn't Like:Sometimes there was noise and hiss mixed with the sound, what could have been interference. In this case switch to another channel.The tune and volume controls are too close to each other.The bass wasn't as powerful as I would have liked.In the included manual, they listed a 3.5mm / "" adapter, which I could not find.",1197936000
"06 6, 2008","[0, 1]",4.0,Does the job I needed it for,B0001FTVEK,J. Sheehan,A3REBLNXKDOH3M,"I finally got fed up with tripping over wires at my desk every time I got up.  I often listen to internet radio or music while working, and also like to turn my chair around to look out the window while thinking about something.  This often led to my headphones wire getting tangled up in my chair and getting ripped off my head when I got up.  I have killed more than one set of headphones by them getting flung from my head to the ground or tearing off the connector.  I had been considering wireless headphones for a year or more before finally making this purchase.One of the aspects of wireless headphones that I wanted to avoid was the need to replace batteries every week or so.  I am not good about keeping batteries handy, and would probably end up not using the headphone much because they would be out of juice.  The handy charging stand fixed this issue.I have also been afraid of the dreading ""hiss"" of wireless headphones.  While no audiophile, I am not a fan of white noise messing with my music.  I am happy to say that has not been an issue.  Every once in while, if I turn my head one exact way I get some static, but it is very minor.  Overall these headphones sound better and are more comfortable then the wired Sony MDR-NC6 headphones they are replacing.  The Sony headphones have noise canceling that works great, but for office use that is a bad thing.  You don't want to be too isolated at work.  I will keep the Sony set for airplane travel to cut the drone of the engines.",1212710400
"09 22, 2013","[0, 0]",3.0,Excellent reception....but,B0001FTVEK,JStewart82,A3LYAEH6HDDO24,Very pleased with the range and quality of reception;  gave the headphones a 3 because of the loose fit.  I probably have what would be considered an XL hat requirement and these headphones are still rather loose.,1379808000
"12 28, 2012","[0, 0]",5.0,"Great Sound, Comfortable Fit",B0001FTVEK,Jus Sayin',A1SESAC1IHP749,"I got these so I could watch TV while on the treadmill without annoying my housemates with a blasting TV. I did a lot of research before selecting these, and I'm very satisfied with my purchase.",1356652800
"09 9, 2011","[0, 0]",5.0,A Great Option to Have,B0001FTVEK,Justin D. Brown,A3NOMBOXB1MLY4,"I am very pleased with these headphones. I've been using them on 2 different TV's. I have used them with my PS3, and they work excellent. I've also been using them late at night when watching movies. It's nice to be able to enjoy a movie or game and not have to worry about waking your child up. I would definitely recommend this to anyone.",1315526400
"05 20, 2010","[14, 14]",3.0,"Good headphones, awful powersave feature",B0001FTVEK,"Justin ""Justin""",A20T4PUI3U5C9R,"Look, these headphones have some nice features and some not so nice features.  I'll list them out for you, you make up your own mind.Positive features-Charging system- could not be easier.  Put headphones onto cradle.  Done.Reception - at first I was getting lots of interference, I had to change the baby monitor to channel B, now they are crystal clear.  I sit 4 feet from a Wireless access point in my office and there isn't any issue.Sound quality - they sound really good. Not spectaular, but good.Sound Volume - no issues for me here, I have them plugged into a home theater amp and the is plenty of volume left to be raised.Negative features-Comfort - the foam ear pieces are completly flat... not cupped like my Sennheiser HD590.  They sit ON your ear, not around them.Base Auto Shutoff-  Shuts the base off after a few minutes of no sound.Regarding this last point... this maybe would make sense if the headphones themselves shut off if no audio was detected for 3 minutes.  In this situation, the BASE shuts off, leaving the headphones to happily drain battery life.  Why ?  and Why such a short time period?  Are we saving THAT much power?  Could they have let the base sit.. maybe 5 minutes? 10 even?  Enough time to grab a drink of water or something?  I don't know about you, but for me, the beauty of watching TV and movies at home is the simple fact that I CAN pause, take a break, check on the kids, answer an e-mail, then go back to the entertainment.  But leave these alone for 3 minutes and you'll return to the lovely HISSS of the base shutting off while the headphones are still on.  Then it takes a few seconds once pressing play, to get sound again.  So now you have to rewind a few seconds, or just miss some dialogue.  Stupid stupid auto shutoff feature.",1274313600
"01 30, 2014","[0, 0]",4.0,RS 120 Works well,B0001FTVEK,justolebob,A30GU1SN7WMRIS,Product arrived on time and works very well in all applications. Great range. I did find however that  the headband  will stretch a bit with use. The padded ear cushions also hold the heat from your ears which can be a little irritating if using for 1+ hours. However for the price and quality I would recommend this product.,1391040000
"03 12, 2008","[1, 1]",2.0,Quality sound/uncomfortable headphones,B0001FTVEK,jwaand,A66I6R8RLDHD2,"I own the RS120 and a extra headset HDR120. I find both headphone sets to be very uncomfortable very quickly. I also own a Radio Shack wireless headphone set that is installed on another TV. The earphone cushions are big soft and fit over the ear, will stay on while you exercise, and they are comfortable for hours.  The RS120/Hdr120 on the ear headphones begin to hurt almost immediately. The sound quality is great, but the ear cushions are ultra thin.  Additionally, if you want product support by phone, be ready for a challenge.",1205280000
"05 12, 2013","[0, 0]",5.0,Finally can hear,B0001FTVEK,JW,A12JRUHLRWNKYI,Bought these for my dad who kept blasting the speakers wide open. He is very happy now that he can watch whatever in total comfort.The replaceable Ni-Cad batteries are a nice touch.Good build finish and excellent reception.,1368316800
"04 23, 2009","[0, 0]",1.0,Don't like 'warm and fuzzy' on my ears,B0001FTVEK,J. Yaki,A3IIE1LMJWDEPA,"I want wireless headphones because I prefer not having the cord dangling from my head at work. I took these out of the box, and was amazed at how bulky they are. I put them on my head, and felt these warm fuzzy cups engulf my ears. That was enough. I knew I could not wear these at work to listen to my Sensa portable music player - they make my ears too hot.",1240444800
"02 18, 2014","[0, 0]",2.0,not very good,B0001FTVEK,Kann,AE1ISHZZ3JNGL,"for the price they are very sub par, and does not do what they claim, would never buy again.  Buy a lower cost brand they are better. You are paying for the name with these.",1392681600
"12 29, 2012","[0, 0]",5.0,Just what he wanted!,B0001FTVEK,Karen B,A1U36Z411AEW7I,"I bought the Sennheiser 120's for my husband to wear while watching TV or playing video games.  Being hard of hearing, he would turn the volume up so high, there could be no other conversation in the room.  They really work!  Very easy to hook up and use.  He has not had any problems with static or volume control, as mentioned in other reviews.  Also, very easy to recharge.  Great product!",1356739200
"06 1, 2014","[0, 0]",5.0,Best idea ever!,B0001FTVEK,"Karen W. Newton ""speculative fiction writer""",AP6B5W86G979X,"We re-did our den as a sort of man cave, with a huge flat screen TV and a beer fridge, but we didn't add a door, so these headphones serve a very useful purpose. My husband can hear all those football games perfectly, and my daughter and I don't hear them at all. He says he hears things through the headphones -- like background noise in the squad room, when watching Law and Order -- that he never heard before. He can also still follow the game when he goes to the kitchen for something to eat or even when he gets the groceries out of the car in the driveway. Best gift idea ever!",1401580800
"12 8, 2013","[0, 1]",1.0,Could not get to work,B0001FTVEK,Kari McGrath,A3NUIG8AO9I6JM,Could not get this headphone to work at all with my computer.  I'm just writing this last sentence to get to the required length.,1386460800
"01 28, 2014","[1, 1]",5.0,I CAN HEAR AGAIN.,B0001FTVEK,Kate Kenworthy,A1V9D8AFCMHZ56,"I am so grateful for this item.  I have trouble hearing the television sound, especially movies, the sound is kind of muddled or muffled to me.  I also bought a sound bar which made some programs clearer to hear but still found it hard to hear movies and other shows unless I was sitting on top of the TV sound bar.  I had TV ears but got fed up with how often the stupid ear plugs would fall off and the replacements were quite expensive.  Finally glued them on and they lasted until the ears finally wore out and started not to hold a charge for very long.  That's when I bought the sound bar.  Since I still couldn't hear perfectly I did some Amazon research and bought these headphones.  Performed beyond expectations.  The sounds are crystal clear, setup is easy and it's attractive enough that I don't mind it sitting next to the TV.  I was watching a show the other night and in the show a phone rang in the background and it was so clear I thought it was the phone in my house.  The background noises in the movies on TV sound like they're in my house.  Next year is probably a hearing aid but I won't need to put my hearing aid in when I'm watching TV.  I'll just reach for my Sennheiser headphones.",1390867200
"03 12, 2014","[0, 0]",5.0,Great sounding,B0001FTVEK,Kat,A3CLNQUZG3OXVZ,"Great sound from these headphones.  Occasional static, but doesn't last long or interfere with listening to tv.  Came very promptly.",1394582400
"01 6, 2009","[0, 0]",3.0,Had to be invented by a woman!,B0001FTVEK,Kathy Austin,A3N0029I3P9939,"These headphones are a gift to womankind everywhere! Had to have been invented by a woman whose man constantly watches TV. Peace and quiet! Hubby adores these! He said the sound quality is fantastic, NO static, he can move from room to room without losing signal and they are very comfortable to wear. Best Christmas gift I ever got him! High quality, great design, LONG battery life!",1231200000
"04 26, 2014","[0, 0]",4.0,good headphones,B0001FTVEK,Kay. Griggs,AZ99NZLNH8KVU,"I utilize these headphones on my job, within part of my job and they have been very useful and helpful.",1398470400
"02 21, 2014","[0, 0]",4.0,Worked well  but not for me,B0001FTVEK,Kayla,AL7BV65UEAV7O,"I've only had them for two days. My own error, I didn't click all the thumbnails--these are over the ear headphones, but not cups, and I didn't catch that. I prefer cup headphones so I can have that seal and since these were not that style, they were really uncomfortable for me (pushing on tragus/forward helix piercings).That being said, the sound was pretty good considering they had no seal. Definitely not something I'd use in a library but for watching movies late at night and not wanting to disturb others, they're perfect. I never tested the range/battery life though so unfortunately this isn't a lot of help.",1392940800
"05 23, 2013","[0, 0]",5.0,Would like to buy one more soon,B0001FTVEK,KBJ,AG4Q7JANPVR4G,"I bought this for my husband as one of his Christmas presents last year, and he has declared this being one of the best Christmas presents he ever received!I can certainly see why after trying it for myself, and now I want to buy one for myself except I am trying to cut down my TV time.  :)The headset is very well cushioned, so it is comfortable even with hours of use.  The sound quality is very good, I enjoy it even more than the surround sound through the speakers without it.",1369267200
"08 2, 2012","[2, 2]",5.0,After 8 months...,B0001FTVEK,"Keith M. Hamm ""KMHamm""",AXUJOJ21SN31V,"I got these for my girlfriend to use when she exercises so that she can watch TV while she's on the treadmill or bike. We've had them about 6 months and they've worked flawlessly. The range is great - we can go upstairs and listen to our music or TV the entire time, or even out in the back yard. Hook-up was easy and this is one of the top brand names. I've used them a lot also for watching late night TV while everyone else is asleep and they haven't disappointed me at all. They're comfortable and easy to use. I've had experiences with both Sony and AR sets before and these are better. One thing - when you put the phones back in the cradle, make sure they're facing the right way around or they won't charge. There's a light to show if they're charging.",1343865600
"09 25, 2013","[0, 0]",3.0,Automatic Shutoff a Negative,B0001FTVEK,Keleh,A1TC98ZYIPLCIS,"I cannot recommend these headphones, solely because of the automatic shutoff feature. I use the headphones to listen to my TV while I jog on my treadmill. I have no complaints about the quality of the sound for the price. However, you must keep the volume of the sound up above a certain level or the headphones will automatically shut down with nothing but loud static. It is then somewhat of a pain to get them working again. I usually turn up the volume on my TV all the way and they will start again - but then you have to turn the volume down again to a reasonable level. If you are watching a movie and there is a brief lull or quieting in the sound - as happens not infrequently with most movies - you are in danger of an automatic earphone shutoff. To avoid this, you must keep the sound up to an unpleasantly loud level - that is not a good idea with earphones, as I understand it can lead to eardrum damage over time.Update : Since I wrote this review, I have learned that if I turn up the sound on my TV as loud as it will go, and then use the headphone control to adjust the volume, the cutting out problem is largely eliminated. Therefore I have adjusted my review from one star up to three stars. However, the earphones still cut out if you pause the TV volume for a couple of minutes, for example when you want to talk to someone or get up to do something.",1380067200
"08 28, 2010","[1, 1]",5.0,For the price hard to beat,B0001FTVEK,Kelly Carlson,AGZDSR4R8SA2S,"First the bad which are minor.1. I would like it if the tune and volume controls were not so close together but it is a minor thing.2. The connection cable ends in 2 RCA connectors. They include an adapter that plugs these into with a male 3.5 mm standard plug. The problem with this set up is there are going to be some situations where it is going to be very hard to plug in because of the size of the adapter. I can just barely plug it into my flat panel TV because of this. I promptly ordered a short extension off Amazon which will fix this. Again it is a minor thing.Now the good. These use replaceable AAA rechargeables. They come with 2 and I have some already so I was ready to go. I bought these to watch TV at night. I work odd hours so I often want to watch TV while the Wife is sleeping. Had been using a set of headphones with an extension cord which of course works, but is a PITA. I had looked at some of these that were cheaper and saw a lot of bad reviews. These work great, sound is about the same as the headphones I had been using, and no more wire in the way.So I decided to see how they sound with music. Plugged into an MP3 player in bedroom and walked around the house. Sound quality is about the same as a set of cheap wired headphones. You do need to have the volume up all the way at the source to keep the hiss out. Now if you are expecting great sound quality, no you will not get it. This same company makes some of these that cost 3 times as much so I expect they would sound much better. Bottom line for the price of these you get your moneys worth.",1282953600
"04 22, 2013","[0, 0]",5.0,wow-audio great,B0001FTVEK,ken,A146CA37V0450V,"Has great distance before a hiss starts to invade the clear audio. Headphones always charge--at least the charge light stays on when they are in holder, They charge might actually stop at full charge--I do not know, 3 frequency channels available if one is picking up some noise, or another channel is being used nearby. No such problems for me, so no report on cross-talk between frequencies. Real good frequency response----audio quality quite good. 2 aaa batteries easily pop under one earphone cover, and last forever, being rechargeable. A bit difficult to keep on head when bending over. Very slight pressure against my ears allows them to slide off, but if they had tight pressure, you'd surely get a headache. Have these on for hours sometimes and no discomfort. Use for a computer internet radio station, online storage music site, tv stereo audio--as other people in house use headphones, too, so anyone without them, have silence. Only use headband over top of head, as behind head, they'd slip right off. Green light shows when audio is present. Volume control on one ear. Also control to tune in audio for selected frequency. Another switch is on/off. Directions tell how to reset audio if lost. Unplug unit. Uninstall batteries then reinstall.  Hardly happens, though.  headphone AUDIO stops, get a hiss, so turn them off ! Hiss not heard at all when audio is present. Music and voice sound normal-------for sure, not tinny. No need to go sennheiser digital, though--since you'll also lose some wireless distance. Signal goes through walls, easily--never thought wireless could be so good.  Perhaps adding a personal chin strap to earphones on both sides, could keep them on when bending.  Headband very sturdy throughout. Sennheiser is QUALITY. UPDATE=UPDATE=UPDATE = I WAS ASKED ABOUT volts AND adapter--Must use 2 1.5 volt AAA battery rechargables in earpiece--long lasting. Input cord end from headphone cradle that plugs into output source is stereo RCA plugs that go to an adapter that goes to 3.5 mm (1/8"") plug, that CAN then go to included adapter for phono plug if needed.",1366588800
"04 11, 2014","[0, 0]",5.0,Sensational,B0001FTVEK,Kenneth Beer,A12V4QGBVTH2BC,"Best wireless I have used. I have gone through 2 Sony's and 1 JVC and this is by far the best. Clear sound no buzzing, warbling, like others.",1397174400
"09 5, 2010","[0, 0]",4.0,Nice headphones with good range.,B0001FTVEK,"Kenneth Chen ""Ken""",AGPCM2O0UCMTX,"The headphones sounded great and fit comfortably over my head.  I noticed some hissing and static but I could minimize these with the fine tuning dial.  Some may find these headphones a little bulky and heavy, but they were comfortable to me.",1283644800
"02 5, 2012","[0, 0]",5.0,awesome,B0001FTVEK,Kent,ALX3DEOD3RQEG,"Got these for Christmas because my wife is tired of my blowing out the windows due to my hearing loss.  I had given up watching TV because I couldn't hear or understand the soundtrack.  Tried an RCA set and took them back.  The sennheiser's are beyond belief.  I can hear every little sound. I can go anywhere inside the house and quite a way across the yard and still here clearly. I haven't experienced sound like this in years. The stereo separation of this headset is almost like surround sound. Not quiet, but close enough for me. No distortion, no hiss.  Even the quiet moments in a movie are enjoyable.  I have an extensive collection of movies that I had to watch when I was home alone.  Even then it wasn't enjoyable because I couldn't make out the background sounds and conversation that adds so much to a movie.  I am currently working my way back through my favorites and enjoying them as much as and maybe more than before my hearing loss.  All I can say is...thanks sennheiser for not only a great headset but a headset this good at an affordable price.",1328400000
"02 28, 2013","[0, 0]",4.0,Good headphones,B0001FTVEK,Kenton D Miller,A2LRF8PWY4ZGTJ,Can watch my tivo in the bedroom and in the living room through the wall.  Like that the charging cradle can be mounted to the wall.  The sound is not as deep and the earpieces do not fit as snugly on the ears as the top end Sennheisers.,1362009600
"12 1, 2012","[0, 0]",5.0,Works great,B0001FTVEK,Kevin H.,AUFO5GFCYNRD5,I use these headphones to watch TV quietly in the family room.  These sound good and are fairly comfortable and the recharging base is convenient.The only problem I had was the headphones not sitting flush on the base to make contact for recharging.  The easy fix was to extend the earpiece slightly on opposite the side that does not contact the base.,1354320000
"12 31, 2013","[1, 1]",5.0,"MY second while it was lower in frequency, I still use my first one for the best presentation when needing Sennheiser's best.",B0001FTVEK,Kevin Michael Callihan Sr Esq [Retired/Disabl...,A1M9VJB1POQ6AK,"This is referenced as the best in a beginning, reasonable category and I am enjoying it side by side with the first 120 series.  They are top of the line wireless while being more than reasonably priced.",1388448000
