reviewerID,asin,reviewerName,helpful,reviewText,overall,summary,unixReviewTime,reviewTime
A1TITHOSW4GLDP,B000BTL0OA,J. Sekula,"[0, 0]","If you know what you are doing, you can turn this into a near-enterprise-class beast of a router.  This is a nerd's dream.  I have openVPN up an running and can now VPN into my home network from anywhere, with very tight security.  Unfortunately, if you don't want to play with it, it is really only an average router for the price due to Linksys's firmware having poor support for P2P sharing, and other applications with many open connections, not to mention not supporting all of the advanced features DD-WRT provides.",5.0,Awesome with DD-WRT firmware,1191801600,"10 8, 2007"
A2GWJHRQFAWGSP,B000BTL0OA,JS,"[0, 0]","This is the 2nd one of these I've purchased.I'm not too thrilled with the default web interface/configuration tool, so I flashed in the dd-wrt opensource version:http://www.dd-wrt.com/It's a far superior interface, and provides much more control over the device.",5.0,"Simple, inexpensive, does the job!",1371600000,"06 19, 2013"
A2MK39STCEO7W5,B000BTL0OA,Juan E. Rivera,"[0, 0]",I have had many routers and most of them didn't last me long.  After a few months of owning them I would start getting disconnects.  I have owned this router for a year an a half without problems.  It works well and it is reliable.  I had some problems setting up some VOIP but updating the firmware resolved that.  I removed on star because the technology is outdated.  It would be nice to have the equivalent router with support for 802.11n and gigabit ethernet.,4.0,Very reliable,1322179200,"11 25, 2011"
A1HTZLEH8Q53EJ,B000BTL0OA,Judson Chung,"[0, 0]","This unit is so reliable. One of my friend got an ASUS wireless N router and consistently getting packet drop (even with wired connection), so I troubleshoot with my 54GL and it the problem disappear. It does not have the fastest wireless speed don't bother, cause US internet is so pathetic that 50Mbps is consider ""extreme"", while other countries offer 100+ Mbps as ""Standard"". So if you are staying in US, 54Mbps is way more than your ""extreme"" internet needs.If you are not a total newbie with computer stuff, this unit can offer a wide range of functions. All you need is a custom firmware (DD-WRT, Tomato, etc.) with some settings, then you can transform this little bad boy into router, access point, repeater, etc. Just need to follow the custom firmware web and go through the step-by-step setup. You will save a lot of money from buying a specific network product this way.My current setting is one 54GL from the modem, and wire connected to the second 54GL which serve as a wireless access point. With this setting I can cover my whole house with wireless signal and transfer the wireless between each router seamlessly (same SSID and encryption).I've own this modem for over 6 years, and it works flawlessly until today. For the relative low cost, reliability, and flexibility, this unit well deserve a 5 stars rating.",5.0,"Not the fastest, but the most reliable",1383350400,"11 2, 2013"
A36NB8VS3PFM5C,B000BTL0OA,Julius Kovatch,"[2, 2]","Easy installation, excellent performance, very good signal in 100 ft radius. Highly recommend.",5.0,Linksys-Cisco WRT54GL Wireless-G Broadband Router,1163030400,"11 9, 2006"
A339BEBKEED0U9,B000BTL0OA,Justin,"[6, 6]","I've had Dlink and and Netgear routers in the past, and then I saw all the great reviews on this router.  I am a beginner when it comes to routers, so I basically just use the basic settings to get it started.  But with the software this router comes with, it is very easy to name your own network and set up a security code so your neighbors can't connect to your network.  The range on this router is incredible.  We have a two story house and I keep this at the upstairs computer.  I can get near excellent reception in the basement which is about 30-40 feet below.  I was so amazed on how well this router gets reception and how easy it is to setup security for the price range.  Definately get this router.  They have a new model out, but I would still go with this one, because I've heard a few bad things about the new ones.",5.0,Best router for a reason,1242172800,"05 13, 2009"
A3QX1JSUDF9CIZ,B000BTL0OA,Justin Robertson,"[0, 0]","Add me to the list of people who love this router due to its ability to be flashed with open source firmware.  I'm using the Tomato firmware ( [...] ) and have been very happy with it.I run a small IT consulting business, and in that capacity I have used maybe 50 different small business/home routers.  While many routers are just fine from a hardware perspective, very few of them have great firmware.  (This is similar to ATI in the graphics world - hardware is great, but their drivers used to suck.)  Cisco has solved this problem by offering a router that openly supports third party firmware.  It seems like a win-win:  Cisco doesn't have to spend time and money developing a full-featured firmware for their router (which is apparently hard for them to do), and they don't have to support the router for anybody who uses a third-party firmware.I don't know why Cisco changed the original WRT54G to not support third party firmwares, but I'm glad they brought it back as this WRT54GL.I have been using this router for just over 4 months, running Tomato firmware, without needing a single reboot.",5.0,Awesome router due to open firmware,1275004800,"05 28, 2010"
A3EW0H4L61EQR7,B000BTL0OA,"J. Wallace ""jade""","[0, 0]",I have 2 and have never had a problem with them. One I've had for 3 years and now another one to use with the whole house wireless internet to booast security.,5.0,Good price for a good product,1364083200,"03 24, 2013"
A1EWQ5Y6HHSJGX,B000BTL0OA,"J. Watts ""JLW""","[0, 0]","I'm just using the router with the Linksys firmware at this time and it works quite well. My laptop computer is in a RV about 130 feet from the house computer with the router. Eventhough my signal is rated at ""low"", I have never been disconnected from the internet. The speed from the cable hookup is quite good.If I have problems, I plan on installing the third party firmware, but right now I am very happy with the original firmware.",5.0,Excellent Wireless Router -- Good Tech Support,1203811200,"02 24, 2008"
ANOKSCZY7B055,B000BTL0OA,J. Whittenburg,"[20, 22]","Do not buy the WRT54G, spend the extra $15 and get this model. The extra memory and flash make it well worth it, especially if you spend a lot of time online using different programs. The functionality of the system is superb and wasn't a problem to setup and get connected to the internet using Bellsouth/FastAccess DSL. This router connects up my 3 PC's, 2 laptops, and an xBox without any issues.If using this router and you are technically minded I recommend installed DD-WRT firmware as it's advanced feature set is great and loosens the restrictions some of the settings of the Linksys firmware.",5.0,Excellent Little Router,1153008000,"07 16, 2006"
A1FMPZZL2642ZL,B000BTL0OA,"J. Wright ""jwright347""","[0, 0]","I have two desktops which I wanted to connect to broadband modem via cat5 cable plus we intend to purchase a laptop around Christmas and we want to connect it via wireless.  We also wanted to network.There is no paper documentation but there's supposed to be a user's manual on the CD.  I didn't need it so I haven't checked.  Setup was very simple, just insert the CD and follow prompts.Both desktops accessed internet immediately and speed seems the same as before.  However, after running the Windows XP Home network setup wizard, neither pc could see the other on the network.After some experimentation and searching the net for a solution, it turned out that I only needed to do two things......disable Norton 360 firewall and manually configure the router.  That is, manually assign the ip addresses for both pc's.I can't comment on the wireless capabilities yet but, having used Linksys products almost exclusively, I don't expect to have any problems.  Good stuff.",5.0,Nice internet and networking solution.,1226361600,"11 11, 2008"
A31AKXUO3FYRN6,B000BTL0OA,J. Wyant,"[0, 0]","I absolutely love this router. This replaced a Netgear that I had a lot of problems with and there is no comparison between it and this Linksys router. Easy to set up and very reliable, what more could you want?",5.0,Love this router,1324771200,"12 25, 2011"
A3IIE1LMJWDEPA,B000BTL0OA,J. Yaki,"[2, 13]","I had a LINKSYS Model: WRT54G V4, which I finally gave up on. Every 2 months or so, like clockwork, for the past year, the router has just stopped working. Then I go thru the whole route of calling Cox, then having them tell me to call Linksys... I had to pay a couple of times to a Linksys rep to fix it. The router worked ok the first couple years, but the last time I just had the Cox rep leave the Netgear WGR614 G router, it was $45. I thought I would have to buy new adapters, but the others work ok with it. It seems a little slower, like when I open email, but hey, if it WORKS that's the main thing. It's been only a week with the Netgear router, but so far so good.",1.0,Breaks Every 2 Months,1229644800,"12 19, 2008"
A3RU2NYEE0KZRD,B000BTL0OA,k2dice,"[0, 0]",Easy to set up and easy to use. It does what it is supposed to do. It handles 2 phones and two laptops with no problems. Not fancy but it works.,4.0,Easy,1387411200,"12 19, 2013"
AYE3H4E1MB1AZ,B000BTL0OA,K4m1L,"[0, 0]","Well, I had this router for about 5-6 years now and never had a problem.My model is WRT54G not the L version, but it's the same device.My network can be found from the back room to outside of my house (frontyard) or apartment and the router was so easy to setup.Since buying it in'06 I also bought the new 5Ghz routers, another Cisco Linksys 4500 5GHz Dual band and a Netgear N600 - let me just say non measure up to this good old boy. The new Cisco is great and fast but not through walls - I gave it to my parents, Netgear was a piece of garbage - always bricked, can't use it, You have to pay to get phone customer service and the junk is setup through a web browser (utter BS!!!!) - the worst product I've ever bought.In general the WRT54G or WRT54GL is best and most reliable piece of networking equipment I've ever seen or owned.Simple, easy to use, and still fast - You can't go wrong with it.Peace.",5.0,Never fails (~6 years and counting :D),1351468800,"10 29, 2012"
A6A8TB3298VJT,B000BTL0OA,KACRX,"[2, 2]","I have an old WRT54G that still functions.  Feeling the need to upgrade, I went through an ASUS wireless N router and also a Netgear AC wireless router.  Both ended up causing days of headache.  I shipped the ASUS back and they sent me a refurbished one that also quit working.  The Netgear AC was also full of problems and I took it back to Costco.  The point I'm making is I should have stuck with my original Linksys.I bought this product as a backup.  When testing the speed, I discovered the newer WRT54GL gave me wireless download speeds of 20 Mbps.  The older WRT54G would only produce 12 Mbps.  (I get wired speeds through this router of 29 Mbps.)  I am now using the older unit as a backup.  This unit is easy to setup, reliable, and requires few reboots.Don't be seduced into thinking you need newer technology to get adequate speeds.  This isn't a gigabit connection.  However, I easily stream Googlecast shows in HD, run a ROKU, and have multiple tablets running at the same time with no drop in speed.  Why would you need an N or AC unit?",5.0,Solid router,1400025600,"05 14, 2014"
AJ00DXOOCDL2C,B000BTL0OA,"Kaleberg ""one_kaleberg""","[20, 25]","Cisco recently upgraded the software of all their routers eliminating the ability to configure your router locally and setting it up to spy on you. They have supposedly backed off, for now, but require users to manually downgrade their systems, and who knows what spyware they're including in the downgrade. My sources are [...] and [...]If you are using a Cisco router or considering buying one, recognize that you may find your router unusable, particularly if you need to use it to access the internet and cannot reconfigure it without network access. Also, consider that they will be collecting information about your network use and the like, possibly for resale.Consider buying a router from a different company or upgrading the router software to an open access package like DD-WRT or Tomato.P.S. I'll be glad to retract this review if the story is unfounded or Cisco restores the old local control software and gets back to selling routers rather than selling out their customers.",1.0,serious privacy and reliability issues,1341360000,"07 4, 2012"
A3I9ZSUFD79P5O,B000BTL0OA,"Kandiru ""Kandiru""","[3, 3]","This is the best out there short of paying $1000 for a Cisco business router.The stock firmware is a joke.I tried Tomato and DD-WRT firmwares and the stock, and i can say that for a small network with VOIP, 4 routers with 3 in bridge mode, 5 PCs, Netflix players, a 4Mb/s Vudu box, and 2 Roku iTunes radios, you can't have better.G is plenty for me, and this machine with Tomato firmware is the mother of them all.",5.0,Tomato rules,1237248000,"03 17, 2009"
A2UBTMZRMMIVKB,B000BTL0OA,"Kathy D. Wolf ""MEMEMAY""","[1, 1]",the linksys routers to me are the best .. I tried one other one lasted a year and was awful . my son has his for so long we forgot when he got it they make them to last I really like them would not have a problem buying another one when I need it...,5.0,love it!!,1374278400,"07 20, 2013"
A278P6T7TZ4XXD,B000BTL0OA,KB_Albany,"[1, 2]","I owned a Netgear router for 7 years. It was working fine until about a few months ago when it started to continuously drop out. I couldn't stay connected for more than an hour at a time.So I decided to change my router with this Cisco-Linksys router as the reviews were generally positive. I installed the software and connected to the router without any problems and the connection speed was great for a few minutes until the speed dropped to 1 Mbps. I tried restarting the router and each time the speed would reset to 54 Mbps but then it would drop back to 1 Mbps a minute or two later.I tried adjusting the settings to no avail. Reading the reviews, it seems its hit or miss with this router, so I'm giving it two stars. Shipped back to Amazon the next day and easy return service as usual.I bought a Dlink router instead for less than half the price of this Cisco-Linksys router and it has been working great.",2.0,Extremely Slow Connection Speed,1327622400,"01 27, 2012"
AJAYI2W04CER2,B000BTL0OA,kben,"[2, 2]",Bought this to put DD-WRT on. New firmware installation went smooth. Have been using it as a range extender with excellent results.,5.0,Great Router,1337126400,"05 16, 2012"
A2HU9YA03YSNYG,B000BTL0OA,K. Bergen,"[0, 0]","This is an excellent home router out of the box. I recommend it to anybody that wants a decent router with decent security. Frankly, if you are just looking for a decent home router, there are cheaper ones out there.The big feature of this router is it's ability to run alternate operating systems. My preference is Tomato ([...]), but DD-WRT ([...]) is a good one as well. Note that these will void the warranty, but if you want things like SNMP and Static IP assignment by MAC address (basically enhance DHCP, or similar to old-style BOOTPD), then that is the way to go.",5.0,"Excellent router, but buy it for the advanced operating systems",1287446400,"10 19, 2010"
A1T1CZN2U416K2,B000BTL0OA,"Kenji Kikawada ""KamiKazeKenji""","[1, 1]","I'm no power user, but as both a technology enthusiast and a hacker, I'm satisfied with this router.Coming from a crappy ISP-supplied 2Wire, it's a world of difference. After about 2 months of use, I can say that I've barely had any problems with it (aside from problems that ended up being my fault).This model is a few years old, and it doesn't have N connectivity, but none of that matters. My family have quite a few wireless devices around the house, and not once has it slowed down, bogged up, or lagged like my previous 2Wire did. Maybe part of that is because the modem and the router are separate (2Wires are called &#34;gateways&#34; because they're both-in-one). Though I've had to reset my 2Wire constantly, and there were times when it just refused to work, the WRT54GL has none of that. I'm probably sounding sensationalist, but it's all true.I'm currently using shibby's build of Tomato (google &#34;shibby tomato&#34; for more info), which is custom firmware. I strongly suggest it to anyone looking for a little more. It's richly featured yet simple to use. Right now these are the features I have with Tomato:*OpenDNS (with parental filtering), with automatic updating via DNS-O-Matic*Two Wireless networks - one main broadcasted WPA2 connection and one hidden virtual WEP connection (for the family's Nintendo DSs to connect to :D)*QoS (quality of service) (I love this one)*Bandwidth monitoring (useful for people like me who have dbag ISPs who cap your bandwidth but don't readily provide usage statistics)",5.0,Perfect basic router,1373587200,"07 12, 2013"
A1GLE2WMZDSL12,B000BTL0OA,Kenton A. Groombridge,"[0, 0]",The best thing about this is that being Linux based there is an awesome custom firmware that makes this baby rock.  Long Live Linux!,5.0,Yeah Linux,1184457600,"07 15, 2007"
AGK1AODUDMD7P,B000BTL0OA,Kevin Frost,"[0, 0]","I love this device very much! Fully brings out my 50 mbps potential, over wifi! I would recommend this product to anyone looking for wireless speed.",5.0,Works like a wonder!,1368576000,"05 15, 2013"
A1LJ3055SF93YO,B000BTL0OA,"Kevin Jensen ""Jensen in the Northwest""","[0, 0]","Still working just fine 2 years after we bought it.  We had some initial trouble setting it up and talking over the phone for an hour with someone with a strong accent wasn't fun, but it's worked fine since.",5.0,Still working just fine 2 years later,1357948800,"01 12, 2013"
A2OTSI6BXB4CT3,B000BTL0OA,Kevin J. Post,"[0, 0]","This is a replacement for a NetGear router the was failing.  So far, after about a month, I'm very pleased with the Linksys.  Setup was easy and within 10 minutes I had it fully configured.  DDNS functions work well with my DynDNS account.  My NetGear router had this functionality as well but it didn't update reliably.  The LinkSys has worked perfectly.  Firewall, NAT, DMZ, DHCP were all very straight-forward.On the wireless side, I already had a LinkSys 802.11g access point.  The two devices complement each other perfectly. I positioned them so they provide great coverage on all levels of my house, my garage and in my yard.This was a great value for the price.",5.0,Great Product,1207180800,"04 3, 2008"
A2Z8BP1MEJGVDN,B000BTL0OA,Kevin W. Willis,"[0, 0]",No problems. Easy setup. I will update later if problems arise. Had two so far and they both are flawless.,5.0,Best ive ever had.,1356480000,"12 26, 2012"
A1VKV8N7NBYNUK,B000BTL0OA,Kiran Wagle,"[1, 1]","I bought this in large part because it's the best-documented home router out there, thanks to all the Linux hackers who work on alternative firmware.  I installed dd-wrt SP2 following the instructions on their website (load the mini version first and then the full version.)  After I managed to wake up the mini version's Web interface (by pulling the power for 30 seconds and/or connecting first via the wireless interface) and installed the full version, the router has been working happily ever since.  (I run utorrent set to use at most 1500 connections.)  I'm tempted to buy a second one and double the RAM to 32M (which requires surface-mount soldering) since the only shortcoming of this box is that it has a mere 16M and after 20 days, has only 700K free.~ Kiran &lt;[...]>",5.0,Lives up to its reputation,1160697600,"10 13, 2006"
A208ESSSDSLWIN,B000BTL0OA,"Kobe 519 ""Genevieve Cherry-Sours""","[0, 4]",Returned product as it wasn't what I wanted. Description led me to believe it was what I was looking for but it wasn't.,2.0,Fast shipping,1399680000,"05 10, 2014"
A3GDEXMU9587JX,B000BTL0OA,"K. Parsley ""kindlekat""","[1, 1]","This is my second Linksys router, and it provides plenty of power for all my Internet needs. I stream internet movies and videos and it runs smoothly with no problems. It was easy to set up with the CD that was included, and it only took a few minutes. Can't be outdone for the price.",5.0,"Plenty of power, works like a champ!",1378684800,"09 9, 2013"
A20YJDWDMWZ9NS,B000BTL0OA,Kpop Fanatic,"[1, 1]","I don't know much about networks and routers. I spent hours trying to get this setup right. I couldn't get all my computers working at once. Reset, unplug, change cables, over and over and was so frustrated. I called my cable company and the rep said he would transfer me to Linksys and they will help me get it working. I don't even remember having to hold and a Linksys rep patiently worked with me for about 20 minutes getting everything working. (My pc had config issues) Works perfect now!",4.0,Linksys support saved me!,1381363200,"10 10, 2013"
A2E9WP0U4TDZQV,B000BTL0OA,K. Riley,"[0, 0]","The firmware that comes with the router was perfectly functional, but I installed dd-wrt ([...]) on the router to get more utility out of it. It works very well, and our wireless internet is very fast.",5.0,Provides great signal,1313366400,"08 15, 2011"
A3094EPI56GKZ6,B000BTL0OA,"Kristen E. Bogren ""Kristen Bogren""","[0, 0]","This is the second router I have purchased through Linksys- The first one was the wrt54g- That router lasted almost 3 years and I am very pleased with the steady service I receive from it and wireless use via my Wii and my laptop.. This router was extremely easy to set up and I have been using it two weeks without any issues at all! For the price, you can't beat this router!",5.0,The best router for my house!,1274400000,"05 21, 2010"
A1AHLIHW8UQ5DP,B000BTL0OA,Ktan,"[1, 1]",After installation my Dell laptop did not receive any WIFI signal.  Called Customer Service.  Was directed to checkconstants.  Service tech asked &#34;What channel are you set on?&#34;  &#34;Channel 6&#34; I answered.  He said &#34;Change it toChannel 9.&#34;  I made the change and suddenly everything worked great.  It was a very simple adjustment and it would be nice if this was part of the trouble shooting part of the installation instructions.  Since then everything has worked fine.,4.0,Easy installation but had to call Customer Service on one issue.,1379462400,"09 18, 2013"
A29FJK41SRREUH,B000BTL0OA,K. Wilson,"[0, 0]","Does exactly what it is supposed to: Using the WRT54GL I have networked four wired computers, a laptop, netbook, two iPhones and a Samsung TV.But... if you get this, the first thing you'll want to do is flash it with new firmware.  I've always used Tomato, but as you'll read in all the reviews, DD-WRT is also a very popular choice.  Flashing the firmware is dead easy... there are tons of guides that have been written up, as well as video walk-throughs posted on YouTube.  A simple Google search will tell you all you need to know.The third-party firmware allows you to do some very cool stuff including the ability to increase the transmit power.  We've moved from the default ""42"" to a TX power of ""70.""  This means no trouble streaming 720p video via DLNA to a television two floors down.Ours has been plugging along now for about five years with no issue.  The only time it gets reset is the one or two times a year we lose power.  Other than that, it's been chugging along nicely!",5.0,The Gold Standard in Hackable Routers,1206576000,"03 27, 2008"
APVAEF5ZIRL6D,B000BTL0OA,Kyle Bandy,"[0, 0]","This router provides excellent durability brought to you by the pioneer in home networking: Cisco.  If you want more features, I advise you install dd-wrt on the router.  It's an open-source firmware for the router that gives you oodles of more features.  Just google ""dd-wrt"".If without the third-party firmware, an awesome long-lasting router.",5.0,Excellent Piece of Hardware,1252800000,"09 13, 2009"
A3G3FWQ45QLTI7,B000BTL0OA,Lawrence A. Nelson,"[0, 0]",I purchased a refurbished router last week and it didn't work. After talking with people who had similar problems I got another one from the same company Cisco. This router is great. The setup was easy and fast. My advice is don't buy a refurbished router. It's not worth it,5.0,great router,1313020800,"08 11, 2011"
A2QO0UTXCQON2X,B000BTL0OA,LinXX MiDoups,"[0, 0]","The reviews i read before purchasing this item really helped. i concur, it's REALLY good and easy to set up.",5.0,nice,1236124800,"03 4, 2009"
AFU3ZZB2DSIZT,B000BTL0OA,Li Zhang,"[0, 1]",Linksys-Cisco WRT54GL Wireless-G Broadband Router  (Compatible with Linux)This is an excellent router. Easy to install. Works great.,5.0,excellent router,1221091200,"09 11, 2008"
A3895VBEZ453XA,B000BTL0OA,L. Larrea,"[0, 0]","I was using an N router that I had to constantly reset, because Wi-Fi would not work.  I finally decided to get this router that I heard so much about.  I immediatly installed Tomato firmware and I have only rebooted it once in about a month.  Works great!  I specially like the ability to boost the signal with Tomato firmware.",5.0,It is really a great router!,1308528000,"06 20, 2011"
A9KZ8ILHR95ZM,B000BTL0OA,"Long Yang ""laolong""","[1, 5]",I have to returned this router which keeps dropping internet connection. This router is also highly troublesome to roboot and it is sensitive to the sequence of insert wires. Working with it is a pain.I bought a netgear router from walmart which works flawlessly.,1.0,horrible touter,1327190400,"01 22, 2012"
