reviewerID,asin,reviewerName,helpful,reviewText,overall,summary,unixReviewTime,reviewTime
A1W2RLS4XCU71B,B000BTL0OA,New Screen,"[0, 1]","Wasted over 10 hours this weekend trying to get this replacement router to recongize my slingbox, which was recognized by my old Netgear, with identical cabling.  I retested by replanting the old one, and it recognized and shook hands instantly.the Linksys did recongize two computers and tivo box, but after many hours on phone with both Slingbox support(superb)and Linksys  (disappointing), unable to get it to connect with the Slingbox.  Returned the router to Amazon this morning.Both my calls to Linksys support were frustrating. Difficult to understand the foreign accent with both experts and had to pay 10 dollars for them to assert remote control over my computer  (sling box was free).  Just [...], I thought, but upon further reflection frealized that this fee is about 20% of the cost of the router!Feel the problem was in the firmware, but in trying to download new firmware from the website, encountered .bin files my computer could not open.I'm not a techie, and this entire exercise seems far beyond the normal user.",3.0,"Doesn't recognize slingbox,  pay for online support",1225670400,"11 3, 2008"
A34PNKEM2THUCH,B000BTL0OA,"N. Heath ""Mr. Orange and Blue""","[0, 0]","While this is an older model, it still works great for my TwC internet service in a smaller apartment. I bought this router because it was cheaper than many competitors and other models on the market but it still had positive reviews. I can confirm that even though the prouct is 7 or 8 years old, it works perfectly for my purposes (50Mbs internet service) and was a great purchase. I would still recommenced this product as a viable option if you are looking for a lower priced wifi router which doesn't need to provide for top of the line internet speeds (most consumers don't purchase more than 30-70 Mbs from my experience), then this router could be perfect for you.",5.0,"While this is an older product, it still works great for my needs.",1384819200,"11 19, 2013"
A3VW1YGC0PMZHY,B000BTL0OA,N. Hegde,"[0, 0]",Before using this router I was using Belkin 54 G wireless router which was real pain. The connection used to drop quite often and the router had to be reset at least twice a week.On the other hand Linksys WRT54GL proved to a solid and reliable router.Installation was really easy. It's been close to six months since using this router and not even once it had to be reset. The browsing and download speeds are excellent. The router supports third party firmware such as Tomato or DD-WRT.  These firmwares give you a host of options such as increasing the signal strength. Finding the channels on which other wireless networks in your range are operating and host of other functions.,5.0,Great Router,1229644800,"12 19, 2008"
A3QZX3FE8FPSIL,B000BTL0OA,"Nicholas Gosey ""platypi007""","[0, 0]","I got the WRT54GL because it is so highly rated with folks who use DD-WRT firmware, and can be used as a wireless repeater with the right version of DD-WRT installed. I haven't used this one as such, but I have successfully set up another the same way. I've been using this one for two years no with no troubles at all. I get too signal in my apartment and even in my friend's next-door. I haven't had any of the issues I'd had previously with other routers signal fading or having to be constantly restarted. I'm not sure how much of that is the hardware and how much the software.If you're looking for something to load custom firmware on, and don't need wireless n, this is a great choice!",5.0,What a workhorse!,1354924800,"12 8, 2012"
AJBSZBP4V8OG2,B000BTL0OA,Nick,"[0, 0]","This is a good, simple router that does the job.  I set this up for a non-technologist a month ago and it has worked flawlessly since then, without the need for a reboot.  It was easy to setup.",5.0,"Good, simple router.",1234396800,"02 12, 2009"
A1N03V52IRZ5PR,B000BTL0OA,"N. J. Simicich ""Gadget Geek""","[1, 1]","Suppose you are like me. You have two DSL lines, you have a far corner of the house that does not get good coverage.You want to automatically detect when one or the other line fails and fall over to the working line, and when the lines are both working, you want to balance your load between them.Get a couple of these routers and install the DD-WRT software. This is not for the uninitiated - but the DD-WRT wiki provides excellent install instructions.Use the install instructions for your exact model of router - they vary.Now, I was able to configure the router I have to have not one but two WAN ports, and to automatically do the routing based on things like source IP address, and which box on my lan, and a couple other things.I found instructions for how to balance two DSL lines on one regular Linux box - and they worked just fine on the router - all I had to do was to create a startup script that balanced things out. Simple, no?And I had poor coverage at the back of my house - so I installed another router back there, defined a WDS connection between them, the routers maintain a WDS connection, and automatically ping each other and reestablish the WDS connection if it goes down - and this means that any device in the house can simply attach to the best signal and the routers handle bridging automatically.Like magic, almost.  As compared to the ZyXel router I had, this box/software combo just plain works.  End of story.  The ZyXel AP I used for a couple of weeks had me convinced that I had a laptop with failing wi-fi. Once I de-installed that and put in the Linksys with the DD-WRT software, everything just worked, end of story. And my failing laptop never failed again.The DD-WRT loadout is as reliable as the Linksys loadout.  Plus, you have full Linux networking including the IP command, so you can do advanced load balancing.  You can log in with any ssh client to get a command line - so that you can do pings from the command line by interface. I retasked one of the bridged lines as a second WAN interface - and it just worked.And if you want to set up a commercial access point, there are instructions for how to do that - as well as the ability to set up multiple isolated access points so that you can have one insecure one for customers and a secure one for your business.The five star rating for this router is based on the DD-WRT software load. The lower individual ratings are based on the Linksys software.If you are not experienced in network use, this sort of thing may not be for you unless you have a friend who can help.If you are experienced in network use, then, well, this sort of thing may be just what you want. I know it was exactly what I wanted.",5.0,"Don't buy this router to run the standard Linksys software, buy it to run DD-WRT",1274054400,"05 17, 2010"
AHDYGAOS7L6WW,B000BTL0OA,noir_lee1907,"[0, 0]","The price is fair if you do not require the high and stable internet speed when you share the internet with different accessories. But if you are playing online game, the quality of this router may not fulfill your demand.",3.0,Fair price in its quality.,1390694400,"01 26, 2014"
A2U7WDQ9MYD2TO,B000BTL0OA,"N. Sandler ""nanfla""","[0, 0]","Installation not as easy as expected.  Required phone call to tech support.  However, after installation, product works good with good range.  Have not had any problems.",5.0,Good choice wireless-g router,1250812800,"08 21, 2009"
A3GOV0OF2K4PQT,B000BTL0OA,OG,"[1, 1]","I bought this router based off the rave reviews, but I must have received a defective router.  The connection would drop out almost on a daily basis and I would have to unplug / replug the router just to get the internet working again.  I thought it might be the Linksys firmware but I had the same exact problems with Tomato firmware.Needless to say, I returned the router back to Amazon.",3.0,Defective Router,1248652800,"07 27, 2009"
A1GDGX206VQVP4,B000BTL0OA,oibv305,"[0, 0]","Even though this router has been produced for several years you can't beat the quality. I bought one years ago when I got my laptop, now I've just bought another one for my daughter to use with her laptop and phone. It is just a good quality router.",5.0,Excellent Product!,1365552000,"04 10, 2013"
ADWUJZ8865J2A,B000BTL0OA,Old Codger,"[0, 1]","I've been using these for years and can add testament that there is probably never going to be a more stable and useable router than these WRT54GL's. Just wanted to inject the fact that there is a wonderful control program called &#34;Tomato&#34; that has been written for these and it is an absolute dream to load and maintain. The guys that put it out are super savvy and have been keeping it up-to-date for several years now. Just look up &#34;Tomato&#34; on Google and you will find it in a flash (no pun intended). The web site has everything you might need to be able to download the code and install it. Also, I have learned that you can keep the speed from occasional lagging if you open these up and mount a few small heat sink modules on top of the capacitors. I have been running one of these 24/7 for 5 years now and it is still responding like a fresh spring chicken.If you need a really great router but don't need all the power and speed in the world but DO need reliability and ease of use and maintenance,this is the one. I'm seriously thinking of getting a new one just in case anything ever happens to my current one. LONG LIVE WRT!!!",5.0,A little antiquated but still the best overall!!!,1403308800,"06 21, 2014"
A1FWPUFCE59E5C,B000BTL0OA,oldconsumer 47,"[1, 4]","I consider myself reasonably computer literate ( First PC in 1980 and on my 11th generation PC now). I wanted to get a reasonably good brand name router to connect my new wireless printer to my home network for all to use. So I researched this o ne and the reviews. Okay a rating of over 90% was great -  I thought. WRONG ! following the directions on the CD is super easy. The printed directions on the CD well are pretty techy.All I want to bo is get my new wireless printer on the network using this router.WRONG WRONG WRONG WRONG WRONG ! ! !!!!Following the direction over and over on each of the network PCS only gave me a case of techy frustration in why the (blank) did  I get this piece of recycle junk junk. I tried Linksys's ""CUSTOMER SERVICE"". Ha what a farce. All I got was boxes on the screen to check and get answers like Your question did not match our answers. You can do what you want - I am sending this thing back.What a waste of my time for a piece of recycled garbage. I hate it.UPDATE: Linksys wanted $130 to come and fix their defective equipment and $30 on the phone to fix it it. Me pay for their errors? Huh? What? Really",1.0,THE LINKSYS/CISCO FROM HELL,1365984000,"04 15, 2013"
A3B5B9RAS70M9T,B000BTL0OA,"Oleg Kharitonov ""Olego""","[4, 4]","I got this router solely because of the -L at the end.  ""Compatible with Linux"" means that you can install your own Linux-based operating system onto the router, which is what I did.  I installed DD-WRT, and the router has been working well ever since.  It's never crashed (unlike the stock firmware), and has never been slow.True, installing custom firmware takes a bit of time, but if you want a stable router, get this one.  It's not much more expensive than WRT54G, but you'll be happier with it if you ever use your network extensively.",5.0,I love the stability!,1193270400,"10 25, 2007"
ANRB1M2FELSFA,B000BTL0OA,Olin Gay,"[0, 0]","This is the third Linksys router I've purchased and the second of this exact model.  Unlike the old 54G model, this has more memory and can easily handle some larger versions of the DD-WRT firmware, although I prefer leaving the micro on for speed.  Loading DD-WRT is as easy as pressing ""Upload"" in the web interface after reading some instructions, and the results could not be sweeter.  The 54GL handles P2P, Hulu, other streaming sites, and gaming without skipping a beat.  Most notably (and specific to this model), I've had no issues with needing to reset the router on occasion, which is common for Linksys routers.  This model can stay up for 30+ days without a power cycle, which really increases the ease of use for people who want to hide it away in a closet.  Wireless range is good to very good, and as a customer, I couldn't be happier.Do yourself a favor if you are using multiple applications on your broadband connection: get this router, and then go get DD-WRT.",5.0,Best DD-WRT Linksys available,1256515200,"10 26, 2009"
A1NHNWB5MGL1OX,B000BTL0OA,O. M.,"[0, 0]","Easy installation, love the Cicso security features and great wireless range from up to 3 floors making this a great investment. Compatible with WEP, WPA and more additional wireless modes for new or old wifi devices. Highly recommended!",5.0,Great wifi range,1231632000,"01 11, 2009"
A37PFSWVJENYC6,B000BTL0OA,pakeonoahu,"[1, 1]","What else can I say? love the WRT and own 3 of this, one as the cable modem router, one as repeater bridge, of course one for spare.",5.0,DD-WRT,1379203200,"09 15, 2013"
A38L8HAA6LMISL,B000BTL0OA,Patrick L.,"[2, 2]","Whoops. One of the advertiser's cons for this router is that it doesn't work with Windows 7. Well, I have been using this router for over a year now with a Windows 7 Home Premium laptop and a Windows XP desktop at the same time. It works perfectly. I don't know about the other versions of Windows 7, but I can't imagine why it wouldn't work with them as well. Could just be a ploy to get you to buy a new router - I don't know.",5.0,Works with Windows 7,1318723200,"10 16, 2011"
A27PF7CJPO7AH,B000BTL0OA,Paul B. Antonin,"[1, 1]",Bought it as a backup to another one I thought wasn't working. Found out the old one is just fine.,5.0,Have had in the past and keep on buying them.,1377734400,"08 29, 2013"
A2J1E3D25AYXZ2,B000BTL0OA,"Paul G. Albanese ""lakepaul""","[0, 0]",Everything was as advertized. It would be helpful if the manual had some hints on what to do if you have an IP conflict between the router and your particular modem. Good product at a good price. Thumbs up!!!,4.0,Nice Wireless Router with good Price,1294963200,"01 14, 2011"
A29KQT5LWVHOTM,B000BTL0OA,Paul,"[0, 0]","I have a 7-year old Toshiba Satellite Laptop with a Linksys Wireless-G Notebook Adapter in it that was installed by my internet provider to connect wirelessly with their modem next to my wife's desktop unit in a different room about 30 feet way. The connection was very slow and the Toshiba often just froze up. So, I finally got this WRT54GL.Installation was relatively easy, but I had trouble getting my new router profile to stay as the default connection. I went through about five Cisco customer reps in India to try to get things right. They were unfailingly friendly and polite and I believe they tried their best to help (contrary to what I see in other customer reviews). I finally ended up with Christina who re-configured the connection remotely and made the new router profile stay on top as the default. Hurray! I am now twice as fast as before and I hope and pray it will remain like that!It appears to me that Cisco has made a successful effort to improve its customer service.",4.0,Keeping fingers crossed,1288915200,"11 5, 2010"
A39OGS7BTY8Z7H,B000BTL0OA,Paul,"[0, 0]",This is a great firewall especially for the novice or non-technical person. I am quite experienced with setting these up and it can be a bit daunting for a beginner. The included CD does the setup automatically which I found annoying but is great for anyone who doesn't know what they're doing. The configuration was done on a Windows PC so I don't know how the automatic configuration works on a Mac. The modem was a Comcast telephone modem and the user was adding internet and the automatic configuration was not bothered by that. The only thing wrong is the wireless encryption is only 128-bit and not the more updated 256. The wireless works quite well with the router set up in the basement of the house you get an excellent signal on a Dell laptop running Vista. This was recommended to me as being a reliable router that would last a long time which is why I purchased it for the user.,4.0,Great Firewall For A Beginner,1237766400,"03 23, 2009"
A24UY2BFLGK163,B000BTL0OA,Peter Besenbruch,"[1, 1]","Updated below.I bought this thing to replace a single port, wired router purchased back in 1997. It was a Linksys, and getting a little flakey. I chose this model, because I thought I might play around with flashing it with the various Linux derivatives out there.I've had it a month, and I haven't done that yet. Since I run Linux, I have to rely on the little Web server it runs to set up the router. Having set up various brands of router this way, I can say the Linksys setup works as well as any.What I like is the stability. There are no more router related hangups, even when pounding this thing. Wireless reception on the opposite end of the house is still at 100%. Yes, it's only G, but the range is superb. Having installed the cut down, 54G in another home, as well as Netgears and Belkins, I can say that the WRT54GL is faster and more stable, even if you don't flash it. It's simply good hardware.Update: I have flashed the unit with the Tomato and TomatoUSB BIOS. I have stuck with TomatoUSB. The most useful thing I have done is incorporate ad blocking in the router. I have also tried using it as a VPN client, but that needs some security kinks worked out.2nd Update: I have been running the 54GL for just over a year. TomatoUSB has proven itself a good, stable workhorse. I especially like the ease of blocking ads with the router, and the ability to regulate the unit's transmission power. I haven't rebooted in six months. Plugging it into a UPS helps with the uptime.3rd Update: It is the end of November, 2013. I just rebooted the router to refresh the ad blocking list. It is the second time this year I did that. The original Tomato programmer quit updating the software, but 4 others have extended the Tomato firmware's capabilities.I note the router is still being sold by Amazon, though it is hopelessly out of date. It's a sign of the quality of the machine. The stability is phenomenal.",4.0,A Classic,1317168000,"09 28, 2011"
A10VIYA5M7OP0,B000BTL0OA,Peter,"[2, 2]","This is one of the best routers ever made. After many years, still running strong, no dropouts, no need to reboot. I had the tomato firmware installed for a while but the latest update was not good and I switched to the Linksys firmware. The internet speeds in my house are 50/25, and the router gives me 23/20 or so reliably. I get strong signal everywhere in the house, including in the backyard.",5.0,A classic,1390176000,"01 20, 2014"
A2D0IG7UP2KATI,B000BTL0OA,Peter Hunt,"[1, 1]","The WRT54GL Wireless router has been around for at least a decade, and there's a very good reason for that: it works, and keeps working.It is a little outdated, only providing up to 54Mbps throughput rather than the higher numbers of its more recent counterparts. But if that is fast enough for your home network - and for most applications it probably is - then you can't so better than this little router.It's simply rock solid. I have one that I've been using for at least 5 years, without a hitch. I rarely, if ever, have to restart it - usually just to upgrade the firmware from Linksys to get feature improvements or better performance. The rest of the time, it's on 24/7. It works just as well as the day I bought it.The stock firmware is lacking a couple of networking features that were on previous models - better logging, NTP options, etc. But really, for most people the stock firmware is just fine. If you do need more sophisticated networking options, there are a number of third party firmware options that provide them - replacing the standard firmware at you own risk, of course.I recently bought a second WRT54GL, and installed DD-WRT on it, to use as a wireless repeater to get a stronger signal in some rooms downstairs. Works just as well, and DD-WRT has some nice features. I keep stock firmware on the main router upstairs.All in all, a nice little router.",4.0,Reliability more than makes up for its age.,1359763200,"02 2, 2013"
A1PVJICI412IN4,B000BTL0OA,Peter Ian Staker,"[0, 0]","ive had this router for along time and it never gave me any trouble. wireless is strong and stable, wired is indistinguishable from direct modem connection for me. great router.",5.0,works great. owned for 3 years and never had a hiccup.,1277856000,"06 30, 2010"
A3K4IFDEHTYRSU,B000BTL0OA,"Peter Marreck ""technophile""","[3, 13]","Hey Linksys (or whoever currently owns you):(I have no idea why Amazon blocks URL's, but before you downvote this, PLEASE google ""Don't Use Linksys Routers"". I am speaking the truth, I do computer security work and scale websites (feel free to google my name), but if you downvote me you are putting other consumers at risk and adding wasted bandwidth to the entire Internet, I am warning you.)I've used Linksys routers in the past with moderate success, but as a router manufacturer, not keeping up with *announced* security vulnerabilities ONE YEAR LATER (which expose anyone's home network who is hooked up to a Linksys router) is COMPLETELY inexcusable.So, Linksys! Patch your f***ing routers (ideally, proactively), or at minimum, use all that corporate money to run a security audit on one! Regularly! Because without doing so, you're basically creating a GIGANTIC botnet slave network and allowing malicious hackers to prey on unsuspecting homeowners AND DDOS the rest of the Internet.",1.0,One star for security,1365206400,"04 6, 2013"
A28Y6CYPSALD77,B000BTL0OA,Phil,"[0, 0]",I ordered this just to run Tomato. One of the few firmware that actually does bandwidth tracking. So far so good.,4.0,Works great once you change firmware,1358121600,"01 14, 2013"
A3MICRVMOFR97Z,B000BTL0OA,phoenix,"[189, 190]","I bought this router about 3 weeks ago to upgrade my Linksys BEFW11S4 802.11b router. The main thing I was looking for is the stability. So far, this router has been perfect, it hasn't dropped the connection yet. It also appears this router has much better range than my previous router. The product comes with a CD which has the installation guide on it. As usual, it's not well written.Update:It has been more than 3 months since I set up this router and I haven't had any problem. - 8/16/06Update:This router has been in operation for 7 months and hasn't had any problem at all. Not even a single reboot. - 1/16/07",5.0,So far very stable,1151020800,"06 23, 2006"
A1360KNMJKN1EM,B000BTL0OA,P. Lewis,"[0, 0]","As a previous owner of a Linksys WRT54G V2.2 model, I expected similar results using this model WRT54GL. However, the unit itself has a greater advantage when I pair it with DD-WRT. That advantage is the ability to move away from using DD-WRT mini and using the full blown version. I have had phenomenal wireless signal and the ability to direct my network traffic manually has been a great feature that this unit handles very well. I was very tempted to move over to wireless N but with having multiple systems that only incorporate wireless G I choose to wait. For the price and upgrade ability to DD-WRT or Tomato this unit will satisfy anyone who intends to purchase it.",5.0,Beyond expectations,1232928000,"01 26, 2009"
A1ZHR8ZKW3HG72,B000BTL0OA,P. McConnell,"[0, 0]",simple setup only took a few minutes and i was up and running. wifi workseverywhere in my house with a strong signal.,5.0,Easy to Use and Works Great,1372550400,"06 30, 2013"
A2TF9VYCDOU0HK,B000BTL0OA,"PonyBoy TwoFeathers ""PonyBoy""","[1, 1]",I've owned other cisco wireless routers and they seem to last my last one only died cause it got cooked from a lightning strike other wise I don't think I'd need a new one. they work great and are easy to set up just load the disk and follow the directions. make sure to change the password it comes with but if you forget your the original password will work and get you back in it. mine is so long i sometimes forget it.  would recommend them to anyone great product unless your house gets hit by lightning,5.0,great product,1356220800,"12 23, 2012"
A3QKR4ARGFLBCN,B000BTL0OA,potameid,"[0, 0]","WRT54GS had gotten a bit flaky and I didn't want to have to mess with changing the rest of my system and figuring out which 802.11 flavors all my wireless devices use, so I just swapped this one in, and everything is back to working great.",5.0,Got this one to replace a 9-yr old WRT54GS,1366675200,"04 23, 2013"
A3FGVC1W7D27I,B000BTL0OA,"P. Shah ""ps""","[0, 0]",I had one of these that lasted 3 yrs.  Eventually it started to drop Wifi connections.  Replaced it with an identical one and this one lasted only 13 months before doing that.  Quality seems to have gone down.,2.0,Dropped connection after about a yr,1391299200,"02 2, 2014"
A5O5MHNYHGNVP,B000BTL0OA,"P. T. Mcnally ""Tim""","[0, 6]","I can't get this to work with my Comcast modem.  It is probably a Comcast problem, but bottom line it doesn't work.",1.0,Router or Comcast?,1376265600,"08 12, 2013"
